QID|QLink|QHeader
45827100|/questions/45827100/torch-how-are-model-parameters-updated|Torch: How are model parameters updated?
45787969|/questions/45787969/torch-installation-error-found-unsuitable-version-5-5-but-required-is-at-least|"Torch installation error ""Found unsuitable version 5.5, but required is at least 6.5"""
45769206|/questions/45769206/pytorch-runtimeerror-assertion-cur-target-0-cur-target-n-classes-fail|PyTorch RuntimeError: Assertion `cur_target >= 0 && cur_target < n_classes' failed
45757774|/questions/45757774/lua-torch-normalization-layer-to-normalize-only-a-part-of-the-tensor|Lua Torch normalization layer to normalize only a part of the tensor
45710359|/questions/45710359/torch-gather-issue|Torch 'Gather' Issue
45693586|/questions/45693586/pytorch-how-to-get-around-the-runtimeerror-in-place-operations-can-be-only-use|PyTorch: How to get around the RuntimeError: in-place operations can be only used on variables that don't share storage with any other variables
45605087|/questions/45605087/which-deep-learning-library-support-the-compression-of-the-deep-learning-models|Which deep learning library support the compression of the deep learning models to be used on the phones? [closed]
45520602|/questions/45520602/parameter-sharing-in-network-with-nn-spatialbatchnormalization|Parameter sharing in network with nn.SpatialBatchNormalization
45513000|/questions/45513000/keras-function-like-view-in-torch|Keras function like View in Torch
45499973|/questions/45499973/missing-dependency-for-hdf5-totem-error-failed-cloning-git-repository-git-clo|Missing dependency for hdf5: totem Error: Failed cloning git repository; git clome time out
45457221|/questions/45457221/build-network-with-shortcut-using-torch|Build network with shortcut using torch
45398461|/questions/45398461/torch-lua-retrieving-n-best-subset-from-tensor|torch / lua: retrieving n-best subset from Tensor
45391552|/questions/45391552/why-can-not-i-use-the-transpose-function-without|why can not i use the transpose function without :?
45389102|/questions/45389102/delete-item-from-torch-tensor|delete item from torch.Tensor
45370085|/questions/45370085/in-torch-why-is-nin-and-vgg19-network-1-top-predicting-always-670|in Torch, why is NIN and VGG19 network 1-top predicting always 670?
45348669|/questions/45348669/transform-neural-network-error-with-loadcaffe|Transform neural network error with loadcaffe?
45326413|/questions/45326413/how-do-i-share-weights-across-parallel-streams|How do I share weights across Parallel-streams?
45265913|/questions/45265913/lua-class-method-skips-first-argument|Lua: Class method skips first argument
45256044|/questions/45256044/lua-read-userdata-as-number-compare-userdata-with-number|Lua: Read userdata as number / Compare userdata with number
45234734|/questions/45234734/similaritymeasure-is-an-invalid-module-name|SimilarityMeasure is an invalid module name
45212122|/questions/45212122/lua-semantic-similarity-using-neural-networks|Lua: Semantic Similarity using Neural Networks
45153627|/questions/45153627/how-to-install-cudnn-torch|How to install cudnn.torch?
45136963|/questions/45136963/torch-not-running-from-cronjob|Torch not running from cronjob
45119821|/questions/45119821/nn-dataparalleltable-fails-for-custom-layers|nn.DataParallelTable fails for custom layers
45111530|/questions/45111530/printing-tensor-containing-more-than-10-columns-in-luajit-torch|Printing tensor containing more than 10 columns in Luajit/ torch
45084936|/questions/45084936/the-grammar-explanation-of-torchcputype|The grammar explanation of torch[cpuType]
45017138|/questions/45017138/why-use-clone-of-relu-in-torchs-inception-net|Why use clone() of ReLU in torch's inception net?
44951759|/questions/44951759/missing-dependencies-lua-cjson-2-1-0-for-installing-fblualib|Missing dependencies lua-cjson >= 2.1.0 for installing fblualib?
44913720|/questions/44913720/requires-grad-relation-to-leaf-nodes|requires_grad relation to leaf nodes
44884523|/questions/44884523/installation-of-torch-not-working|Installation of Torch not working
44872372|/questions/44872372/lib-graphviz-cannot-be-loaded-when-using-itorch|Lib graphviz cannot be loaded when using itorch
44869285|/questions/44869285/earth-movers-distance-in-torch-lua-or-how-to-use-a-criterion-to-just-obtain-a-c|Earth movers distance in torch/lua (or how to use a criterion to just obtain a comparison)
44856691|/questions/44856691/how-do-you-alter-the-size-of-a-pytorch-dataset|How do you alter the size of a Pytorch Dataset? [duplicate]
44830512|/questions/44830512/spatial-reflection-padding-in-caffe|Spatial reflection padding in Caffe
44809446|/questions/44809446/necessity-of-transposed-convolution-when-feature-maps-are-not-downsampled|necessity of transposed convolution when feature maps are not downsampled
44793281|/questions/44793281/torch-cv-warpperspective-resulting-image-is-black|torch cv.warpPerspective: resulting image is black
44785486|/questions/44785486/why-do-they-clone-the-entire-model-before-training-in-torch|Why do they clone the entire model before training in torch?
44766461|/questions/44766461/make-first-layer-of-alexnet-parallel-in-lua|Make first layer of AlexNet parallel in lua
44751305|/questions/44751305/torch-index-operator-with-string-returning-the-original-array-no-matter-what-th|Torch: Index operator with string returning the original array no matter what the input string
44738273|/questions/44738273/torch-how-to-shuffle-a-tensor-by-its-rows|Torch: How to shuffle a tensor by its rows?
44735591|/questions/44735591/torch7-no-batchnorm-or-dropout-but-modeltraining-and-modelevaluate-prod|Torch7 : No batchNorm or Dropout, but model:training() and model:evaluate() produce different results
44720615|/questions/44720615/pytorch-inplace-operation-error-how-to-get-around-it|pytorch inplace operation error. How to get around it?
44717100|/questions/44717100/pytorch-convert-floattensor-into-doubletensor|Pytorch: Convert FloatTensor into DoubleTensor
44643137|/questions/44643137/how-do-you-use-pytorch-packedsequence-in-code|How do you use PyTorch PackedSequence in code?
44631628|/questions/44631628/convert-int-to-pytorch-variable-makes-problems|Convert 'int' to pytorch 'Variable' makes problems
44631520|/questions/44631520/subtraction-of-scalar-from-tensor-yields-inconsistent-tensor-size-in-pytorch|subtraction of scalar from tensor yields 'inconsistent tensor size' in pytorch
44614977|/questions/44614977/is-torch7-defined-by-run-like-pytorch|Is Torch7 defined-by-run like Pytorch?
44607558|/questions/44607558/temporal-cnn-to-classify-sounds-cur-target-assertion|Temporal CNN to classify sounds: cur_target assertion
44595338|/questions/44595338/how-to-parallelize-rnn-function-in-pytorch-with-dataparallel|How to parallelize RNN function in Pytorch with DataParallel
44572163|/questions/44572163/sending-large-images-time-to-the-gpu|Sending large images time to the GPU
44537895|/questions/44537895/convert-nngraph-model-to-nn-model|Convert nngraph model to nn model
44518677|/questions/44518677/tensor-division-in-pytorch-assertion-error|tensor division in pytorch. Assertion error
44514733|/questions/44514733/understand-use-of-nn-identity-in-model-definition-using-torch|understand use of nn.Identity() in model definition using torch
44501927|/questions/44501927/how-to-get-the-momentum-term-in-a-neural-network-in-optim|How to get the momentum term in a neural network in optim
44452571|/questions/44452571/what-is-the-proper-way-to-weight-decay-for-adam-optimizer|What is the proper way to weight decay for Adam Optimizer
44440771|/questions/44440771/understanding-model-defined-in-torch7-deep-learning-framework|understanding model defined in torch7 deep learning framework
44432978|/questions/44432978/parallel-way-of-applying-function-element-wise-to-a-pytorch-cuda-tensor|Parallel way of applying function element-wise to a Pytorch CUDA Tensor
44428784|/questions/44428784/when-is-a-pytorch-custom-function-needed-rather-than-only-a-module|when is a pytorch custom function needed (rather than only a module)?
44426715|/questions/44426715/lua-and-torch-issues-with-gpu|Lua and Torch issues with GPu
44417227|/questions/44417227/make-values-in-tensor-fit-in-given-range|Make values in tensor fit in given range
44408075|/questions/44408075/hdf5-error-while-using-torchlua-unable-to-locate-hdf5-header-file-at-hdf5-h|"HDF5 error while using Torch&lua: ""unable to locate HDF5 header file at hdf5.h"""
44406819|/questions/44406819/pytorch-custom-layer-is-not-a-module-subclass|"pytorch custom layer ""is not a Module subclass"""
44393582|/questions/44393582/why-does-torch-print-function-insert-horizontal-tab|Why does torch print function insert horizontal tab?
44371560|/questions/44371560/what-is-the-relationship-between-pytorch-and-torch|What is the relationship between PyTorch and Torch?
44355792|/questions/44355792/torch-what-are-the-differences-between-using-netcuda-and-using-cudnn-somemod|torch: what are the differences between using net:cuda() and using cudnn.somemodules?
44354679|/questions/44354679/torch-unable-to-locate-hdf5-header-file|Torch unable to locate HDF5 header file
44344953|/questions/44344953/lua-torch-rotate-a-tensor-of-images|Lua/Torch - Rotate a tensor of images
44339375|/questions/44339375/how-can-i-install-python-modules-in-a-docker-image|How can I install python modules in a docker image?
44333992|/questions/44333992/modifying-torch-criterion|Modifying Torch criterion
44270171|/questions/44270171/torch-installation-failure-no-space-left-on-device|"Torch installation failure: ""No space left on device"""
44225279|/questions/44225279/zerobrane-ide-run-to-cursor-ctrlshiftf10-mode-sometimes-not-working-du|"ZeroBrane IDE - ""run to cursor"" (Ctrl+Shift+F10) mode *sometimes* not working during debug"
44198882|/questions/44198882/how-to-determine-whether-a-variable-is-a-nngraph-node-in-luatorch7|How to determine whether a variable is a nngraph.Node in Lua(Torch7)
44197086|/questions/44197086/bug-in-torch7-gnuplot-package-ubuntu-16-04|Bug in torch7 gnuplot package? (ubuntu 16.04)
44180891|/questions/44180891/cant-install-torch-despite-cuda-8-0-and-nvidia-driver-375-with-gtx-1060|Can't install Torch despite Cuda 8.0 and nvidia-driver 375 with GTX 1060
44130851|/questions/44130851/simple-lstm-in-pytorch-with-sequential-module|Simple LSTM in PyTorch with Sequential module
44086167|/questions/44086167/how-to-set-the-range-of-input-values-and-ground-truth-values|How to set the range of input values and ground_truth values
44049054|/questions/44049054/modifying-classnllcriterion-in-torch|Modifying ClassNLLCriterion in Torch
44014400|/questions/44014400/how-to-get-the-output-of-intermediate-layers-in-torch7|How to get the output of intermediate layers in Torch7?
43946813|/questions/43946813/how-to-asynchronously-load-and-train-batches-to-train-a-deeplearning-model|How to asynchronously load and train batches to train a DeepLearning model?
43911320|/questions/43911320/in-function-error-root-torch-install-share-lua-5-1-trepl-init-lua389-in-fun|in function 'error' /root/torch/install/share/lua/5.1/trepl/init.lua:389: in function 'require' [closed]
43899537|/questions/43899537/cmake-set-variable-not-added-not-used|cmake set variable not added / not used
43911320|/questions/43911320/in-function-error-root-torch-install-share-lua-5-1-trepl-init-lua389-in-fun|in function 'error' /root/torch/install/share/lua/5.1/trepl/init.lua:389: in function 'require' [closed]
43899537|/questions/43899537/cmake-set-variable-not-added-not-used|cmake set variable not added / not used
43883512|/questions/43883512/an-error-when-install-cutorch-in-torch7-of-centos7|An error when install cutorch in Torch7 of centos7
43881941|/questions/43881941/error-using-torch-rnn|Error using Torch RNN
43781526|/questions/43781526/pytorch-typeerror-object-takes-no-parameters|Pytorch, TypeError: object() takes no parameters
43779500|/questions/43779500/pytorch-network-parameters-missing-1-required-positional-argument-self|pytorch Network.parameters() missing 1 required positional argument: 'self'
43751498|/questions/43751498/torch-insert-tensors-of-different-dimension-into-a-table|Torch Insert tensors of different dimension into a table
43708693|/questions/43708693/how-to-use-the-bceloss-in-pytorch|How to use the BCELoss in PyTorch?
43680417|/questions/43680417/is-there-a-valid-reason-why-nn-cdivtable-throws-error-when-backward-is-called|Is there a valid reason why nn.CDivTable throws error when backward is called?
43678054|/questions/43678054/torch7-size-mismatch-when-feeding-an-image|torch7 size mismatch when feeding an image
43676613|/questions/43676613/use-openmp-in-the-multithreading-because-of-ignoring-openblas-num-threads|Use OpenMP in the multithreading. Because of ignoring OPENBLAS_NUM_THREADS
43676296|/questions/43676296/using-asm-js-to-convert-external-library-dependent-code-to-javascript|Using asm.js to convert external-library-dependent code to javascript
43637591|/questions/43637591/make1-cmakefiles-test-cpu-dir-all-error-2-when-running-cmake|make[1]: *** [CMakeFiles/test_cpu.dir/all] Error 2 when running cmake
43615167|/questions/43615167/torch-concatenating-tensors-of-different-dimensions|Torch: Concatenating tensors of different dimensions
43614235|/questions/43614235/loading-require-luarocks-installed-using-local-arguement|loading/require luarocks installed using --local arguement
43495098|/questions/43495098/image-warping-in-tensorflow|Image warping in Tensorflow
43457911|/questions/43457911/resuming-training-of-cnn-from-checkpoint-in-torch7|Resuming Training of CNN from checkpoint in torch7
43451125|/questions/43451125/pytorch-what-are-the-gradient-arguments|Pytorch, what are the gradient arguments
43435972|/questions/43435972/torch-rnn-sample-lua-binary-file-exporting|Torch-rnn sample.lua binary file exporting
43431259|/questions/43431259/torch-delete-tensor-columns-by-indices|Torch: delete tensor columns by indices
43430728|/questions/43430728/torch-partition-tensor|Torch: partition tensor
43428762|/questions/43428762/how-to-slice-tensors-with-a-predefined-order-in-torch|How to slice tensors with a predefined order in torch?
43387582|/questions/43387582/torch-lua-how-to-get-and-save-parameters-of-a-trained-neural-network-model-to|Torch / Lua, how to get and save parameters of a trained neural network model to file?
43348407|/questions/43348407/torch-test-sh-usr-bin-lua-module-paths-not-found|Torch test.sh, /usr/bin/lua: module 'paths' not found
43341124|/questions/43341124/how-to-perform-the-output-binarization-of-a-torch-model|how to perform the output binarization of a torch model
43336963|/questions/43336963/how-to-compute-the-pair-wise-addition-of-two-tables-of-tensors-in-torch|How to compute the pair wise addition of two tables of tensors in torch
43336472|/questions/43336472/how-to-prevent-converge-to-mean-solution-for-regression-problems-in-cnn|How to prevent converge to mean solution for regression problems in CNN?
43301907|/questions/43301907/lua-torch-error-while-creating-train-t7-and-test-t7-files-using-custom-data-s|Lua/ Torch - Error while creating train.t7 and test.t7 files using custom data set
43280058|/questions/43280058/how-to-fix-this-cudnn-and-torch-error|how to fix this cudnn and torch error
43262853|/questions/43262853/torch-how-to-get-a-tensor-of-loss-values-during-batch-optimization|Torch, how to get a tensor of loss values during batch optimization
43257007|/questions/43257007/unable-to-run-torch-using-remote-access|Unable to run torch using remote access
43243635|/questions/43243635/torch-image-load-doesnt-work-well-with-named-pipes|Torch image.load() doesn't work well with named pipes
43238409|/questions/43238409/changing-lua-path-in-torch|changing LUA_PATH in torch
43197265|/questions/43197265/is-lua-a-dynamically-typed-language|Is lua a dynamically typed language?
43189975|/questions/43189975/how-to-install-luasql-on-linux-ubuntu-16|How to install luasql on Linux Ubuntu 16?
43187495|/questions/43187495/torch-packages-not-found-after-reinstall|torch packages not found after reinstall
43152643|/questions/43152643/torch-using-optim-package-with-cnn|Torch - Using optim package with CNN
43149280|/questions/43149280/how-to-install-luasql-on-linux-centos-7|How to install luasql on Linux CentOS 7?
43143003|/questions/43143003/how-can-i-speed-up-deep-learning-on-a-non-nvidia-setup|How can I speed up deep learning on a non-NVIDIA setup?
43128544|/questions/43128544/lua-understanding-setmetatable|Lua - understanding setmetatable
43125707|/questions/43125707/neural-network-learning-to-hover-time-delay|Neural Network learning to hover. Time delay?
43103009|/questions/43103009/find-out-what-is-taking-my-memory-in-torch7|Find out what is taking my memory in torch7
43056966|/questions/43056966/ways-to-implement-multi-gpu-bn-layers-with-synchronizing-means-and-vars|Ways to implement multi-GPU BN layers with synchronizing means and vars
43053129|/questions/43053129/prevent-network-weights-to-be-updated-when-performing-backward-pass|Prevent network weights to be updated when performing backward pass
42970009|/questions/42970009/performing-convolution-not-cross-correlation-in-pytorch|Performing Convolution (NOT cross-correlation) in pytorch
42939708|/questions/42939708/attributeerror-module-torch-has-no-attribute-cmul|AttributeError: module 'torch' has no attribute 'cmul'
42894882|/questions/42894882/how-to-convert-a-list-or-numpy-array-to-a-1d-torch-tensor|How to convert a list or numpy array to a 1d torch tensor?
42883498|/questions/42883498/seek-a-considerably-good-performance-deep-learning-architecture-to-run-style-tra|Seek a considerably good performance deep learning architecture to run style transfer algorithm [closed]
42866654|/questions/42866654/what-is-the-difference-between-view-and-unsqueeze-in-torch|What is the difference between view() and unsqueeze() in Torch?
42848513|/questions/42848513/torch-element-wise-logical-operation-and-or|Torch Element-wise Logical Operation and/or
42812402|/questions/42812402/torch-load-saved-model-and-test-a-single-image-for-classification|Torch - Load saved model and test a single image for classification
42796880|/questions/42796880/xcode-for-debugging-torch7|Xcode for debugging torch7?
42795554|/questions/42795554/what-is-setnuminputdims-in-torch-supposed-to-be-doing|What is setNumInputDims in Torch supposed to be doing?
42795144|/questions/42795144/torch-remote-debugging|Torch remote debugging
42789874|/questions/42789874/lua5-2-torch-tutorial-gives-an-index-based-stack-overflow|Lua5.2: Torch tutorial gives an __index based Stack Overflow
42786387|/questions/42786387/split-a-tensor-in-torch|Split a tensor in torch
42765486|/questions/42765486/how-can-i-use-table-layers-in-torch-to-create-my-own-network|How can I use table layers in torch to create my own network?
42753773|/questions/42753773/how-to-limit-round-elements-of-a-tensor-to-4-decimal-places-on-gpu-in-torch|How to limit/round elements of a tensor to 4 decimal places on GPU in Torch?
42698161|/questions/42698161/how-to-convert-matlab-code-mat1mat21idx-2-0-to-torch|"How to convert matlab code ""mat1(mat2(1:idx, 2)) = 0"" to torch?"
42696767|/questions/42696767/running-torch-on-docker-with-cuda-says-module-cutorch-not-found|Running torch on docker with CUDA says module 'cutorch' not found
42694870|/questions/42694870/missing-dependency-for-hdf5-totem-error-failed-cloning-git-repository|Missing dependency for hdf5: totem Error: Failed cloning git repository
42618576|/questions/42618576/how-can-i-customize-the-loss-function-in-torch|How can I customize the loss function in Torch?
42612748|/questions/42612748/how-to-plot-two-lines-with-torch-gnuplot|How to plot two lines with Torch gnuplot?
42596703|/questions/42596703/where-can-i-find-existing-pre-trained-torch-models|Where can I find existing pre-trained torch models?
42582358|/questions/42582358/does-default-zxing-net-mobile-overlay-contain-a-flash-torch-button|Does default Zxing.Net.Mobile overlay contain a flash/torch button?
42566480|/questions/42566480/what-compiler-can-i-use-to-install-torch-which-supports-openmp-and-nvcc-on-os-x|What compiler can I use to install torch which supports OpenMP and nvcc on OS X 10.12?
42562633|/questions/42562633/what-is-a-2d-float-tensor|What is a 2D float tensor?
42537674|/questions/42537674/transform-aaabbb-table-of-tensors-into-nested-ababab-table-of-tensors-in-torch|Transform AAABBB table of tensors into nested ABABAB table of tensors in Torch
42525844|/questions/42525844/classification-with-torch-model-exported-from-digits-lua-5-1|Classification with torch model exported from digits - lua 5.1
42496747|/questions/42496747/torch-lua-get-max-index-from-matrix|Torch - Lua / Get max index from matrix
42444700|/questions/42444700/i-am-not-able-to-install-some-luajit-dependencies|I am not able to install some luaJIT dependencies
42432496|/questions/42432496/multi-gpu-batch-normalization-in-torch|Multi-GPU Batch Normalization in Torch
42418470|/questions/42418470/how-to-turn-on-the-torch-flashlight-with-googleplay-services-vision-api-xamarin|How to turn on the torch/flashlight with GooglePlay Services Vision API Xamarin Android
42354526|/questions/42354526/how-to-save-feature-values-of-all-batch-data-from-pretrained-torch-networks|How to save feature values of all batch data from pretrained torch networks?
42345959|/questions/42345959/access-model-using-dir|access model using dir
42289871|/questions/42289871/how-to-apply-changes-to-elements-of-a-tensor-vector-without-changing-its-referen|How to apply changes to elements of a tensor/vector without changing its reference?
42234735|/questions/42234735/how-can-use-torch-model|how can use torch model?
42232341|/questions/42232341/dividing-a-doubletensor-matrix-by-a-doubletensor-number-in-torch|Dividing a DoubleTensor matrix by a DoubleTensor number in torch
42209606|/questions/42209606/torch-how-to-reshape-a-4d-tensor-in-3d-one|Torch: How to reshape a 4D tensor in 3D one
42144496|/questions/42144496/missing-dependencies-installing-lua-development-tools-ide-eclipse-on-linux-cento|Missing dependencies installing Lua Development Tools IDE Eclipse on Linux CentOS 7
42109084|/questions/42109084/lua-torch-how-to-get-the-print-output-into-a-string|lua torch, how to get the print() output into a string
42087742|/questions/42087742/openface-batch-represent-unknown-object|"Openface batch-represent ""unknown object"""
42016559|/questions/42016559/torch-back-propagation-from-loss-computed-over-a-subset-of-the-output|Torch: back-propagation from loss computed over a subset of the output
42010699|/questions/42010699/how-to-interpret-the-output-of-deepmask-gettopscores-function|How to interpret the output of deepmask getTopScores function
41940858|/questions/41940858/torch7-dataparalleltable-is-not-utilizing-any-gpu-in-evaluation-mode|Torch7 DataParallelTable is not utilizing any GPU in evaluation mode
41924453|/questions/41924453/pytorch-how-to-use-dataloaders-for-custom-datasets|PyTorch: How to use DataLoaders for custom Datasets
41909172|/questions/41909172/unable-to-import-anything-in-itorch-notebook|Unable to import anything in itorch notebook
41861354|/questions/41861354/loading-torch7-trained-models-t7-in-pytorch|Loading Torch7 trained models (.t7) in PyTorch
41852436|/questions/41852436/torch-cunn-install-error-file-already-has-lc-rpath|Torch / cunn install error - file already has LC_RPATH
41799988|/questions/41799988/attempt-to-call-method-random-a-nil-value-in-lua|attempt to call method 'random' (a nil value) in Lua
41778255|/questions/41778255/cuda-torch-integration-cudatensor-class-not-found|cuda torch integration - CudaTensor class not found
41747417|/questions/41747417/real-time-plotting-in-torch|real-time plotting in Torch
41728089|/questions/41728089/can-not-run-lua-script-from-fceux-emulator-usnig-torch|Can not run lua script from Fceux emulator usnig torch
41703184|/questions/41703184/can-not-compile-torch-on-x-ubuntu-15-10|Can not compile torch on x ubuntu 15.10
41659710|/questions/41659710/error-using-caddtable-and-concattable-in-torch|error using CAddTable and ConcatTable in torch
41608741|/questions/41608741/torch-tensor-set-the-negative-numbers-to-zero|Torch tensor set the negative numbers to zero
41607160|/questions/41607160/how-to-add-image-channel-with-torch|How to add image channel with torch?
41558702|/questions/41558702/efficiently-load-and-access-torch-tensor|efficiently load and access torch tensor
41506137|/questions/41506137/torch-how-to-apply-the-torch-built-in-optimizers-to-tandem-models|Torch: How to apply the torch built-in optimizers to tandem models?
41465368|/questions/41465368/torch-cmdline-passing-array-of-elements-to-a-variable-from-command-line|Torch: CmdLine() : passing array of elements to a variable from command line
41506137|/questions/41506137/torch-how-to-apply-the-torch-built-in-optimizers-to-tandem-models|Torch: How to apply the torch built-in optimizers to tandem models?
41465368|/questions/41465368/torch-cmdline-passing-array-of-elements-to-a-variable-from-command-line|Torch: CmdLine() : passing array of elements to a variable from command line
41408204|/questions/41408204/got-internal-error-in-sub-no-metatable-error-in-lua-and-torch|Got `internal error in __sub: no metatable` error in Lua and Torch
41403727|/questions/41403727/set-gpu-usage-in-torch-machine-learning-framework|Set GPU usage in Torch Machine Learning Framework
41331626|/questions/41331626/torch-7-lua-cannot-require-a-so-file-but-package-loadlib-can|Torch 7/Lua cannot require a .so file, but package.loadlib() can
41316739|/questions/41316739/torch-multithreading|Torch Multithreading
41265558|/questions/41265558/thnn-lua110-input-and-gradoutput-shapes-do-not-match-input-90-x-271-gradou|THNN.lua:110: input and gradOutput shapes do not match: input [90 x 271], gradOutput [271]
