QID|QLink|QHeader
66531091|/questions/66531091/torch-parallelize-tasks-for-multiple-gpus|Torch parallelize tasks for multiple GPUs
66467005|/questions/66467005/torchvision-mnist-httperror-http-error-403-forbidden|torchvision MNIST HTTPError: HTTP Error 403: Forbidden
66453774|/questions/66453774/why-flask-does-not-return-result|Why flask does not return result?
66325217|/questions/66325217/upload-data-from-dicom-files-in-torchvision-model|Upload data from DICOM files in Torchvision Model
66235746|/questions/66235746/pytorch-previous-version-installation-conflict-in-my-local-machine|pytorch previous version installation conflict in my local machine
66233993|/questions/66233993/the-transforms-in-the-torchvision-isnt-working|The Transforms in the Torchvision isn't working
66148363|/questions/66148363/torchtext-doesnt-replace-unseen-words-as-unknown-in-test-set|TorchText doesn't replace unseen words as UNKNOWN in test set
66038612|/questions/66038612/how-can-i-use-torch-dataloader-to-get-picture-having-same-class|How can I use torch Dataloader to get Picture having same class?
66028727|/questions/66028727/nameerror-name-utils-is-not-defined-in-pytorch|NameError: name 'utils' is not defined in Pytorch
66002549|/questions/66002549/why-pytorch-fails-to-instantiate-this-neural-network-from-torch-hub|Why PyTorch fails to instantiate this neural network from Torch Hub?
65986446|/questions/65986446/pyorch-applying-a-batch-of-filters-kernels-on-one-single-picture-using-conv2d|Pyorch: Applying a batch of filters (kernels) on one single picture using conv2d
65933454|/questions/65933454/torch-model-forward-with-a-diferent-image-size|Torch model forward with a diferent image size
65910782|/questions/65910782/modulenotfounderror-no-module-named-torch-nn-torch-is-not-a-package-on-mac|ModuleNotFoundError: No module named 'torch.nn'; 'torch' is not a package on Mac OS
65906171|/questions/65906171/is-there-a-way-to-retrieve-the-specific-parameters-used-in-a-random-torchvision|Is there a way to retrieve the specific parameters used in a random torchvision transform?
65874607|/questions/65874607/torchvision-and-tensorflow-gpu-import-error|torchvision and tensorflow-gpu import error
65847198|/questions/65847198/error-while-implenting-the-faster-r-cnn-object-detection-algorithm|Error while implenting the Faster R-CNN Object detection algorithm
65827332|/questions/65827332/import-torchvision-transforms-as-transforms-module-not-found-error-no-module-na|import torchvision.transforms as transforms Module Not Found Error: No module named 'torchvision'
65813108|/questions/65813108/changing-dropout-value-during-training|Changing Dropout value during training
65798315|/questions/65798315/importerror-cannot-import-name-noreturn-pytorch-on-macos-catalina|ImportError: cannot import name 'NoReturn' PyTorch on MacOS Catalina
65795374|/questions/65795374/gcp-ai-platform-error-when-creating-a-custom-predictor-model-version-trained|GCP AI Platform: Error when creating a custom predictor model version ( trained model Pytorch model + torchvision.transform)
65739378|/questions/65739378/pytorch-and-torchvision-fasterrcnn-interpreting-the-output-in-c-genericdict|PyTorch and TorchVision FasterRCNN interpreting the output in C++ GenericDict
65718205|/questions/65718205/runtimeerror-operation-does-not-have-identity-in-f-string-statement|RuntimeError: Operation does not have identity in f-string statement
65705160|/questions/65705160/torch-vision-c-interface-error-unknown-builtin-op-torchvisionnms|"Torch Vision C++ interface error ""Unknown builtin op: torchvision::nms"""
65678813|/questions/65678813/how-to-stretch-and-squeeze-an-image-in-pytorch|How to stretch and squeeze an image in PyTorch?
65676151|/questions/65676151/how-does-torchvision-transforms-normalize-operates|How does torchvision.transforms.Normalize operates?
65675732|/questions/65675732/torch-how-to-use-multiple-gpu-for-different-dataset|Torch, how to use Multiple GPU for different dataset
65658629|/questions/65658629/torch-distributed-broadcast-and-reduce-between-cpu-gpu-devices|Torch distributed broadcast and reduce between CPU/ GPU devices
65636906|/questions/65636906/problems-identifying-images-in-pytorch|Problems identifying images in pytorch
65616837|/questions/65616837/why-does-torchvision-utils-make-grid-return-copies-of-the-wanted-grid|Why does torchvision.utils.make_grid() return copies of the wanted grid?
65528568|/questions/65528568/how-do-i-load-the-celeba-dataset-on-google-colab-using-torch-vision-without-ru|How do I load the CelebA dataset on Google Colab, using torch vision, without running out of memory?
65524657|/questions/65524657/why-does-my-custom-dataset-fail-in-self-transform-object-has-no-attribute-tra|Why does my custom dataset fail in self.transform - object has no attribute 'transfrom'
65499420|/questions/65499420/pytorch-torchvision-how-to-increase-limit-of-detectable-objects|Pytorch/torchvision - How to increase limit of detectable objects
65447992|/questions/65447992/pytorch-how-to-apply-the-same-random-transformation-to-multiple-image|PyTorch : How to apply the same random transformation to multiple image?
65374281|/questions/65374281/why-does-torchvision-pretrained-model-perform-better-than-scratch-trained|Why does torchvision pretrained model perform better than scratch trained?
65363129|/questions/65363129/runtimeerror-the-expanded-size-of-the-tensor-320-must-match-the-existing-size|RuntimeError: The expanded size of the tensor (320) must match the existing size (224) at non-singleton dimension 2
65335043|/questions/65335043/how-much-should-the-gpu-is-needed|How much should the GPU is needed?
65317504|/questions/65317504/runtimeerror-module-must-have-its-parameters-and-buffers-on-device-cuda1-devi|RuntimeError: module must have its parameters and buffers on device cuda:1 (device_ids[0]) but found one of them on device: cpu
65305682|/questions/65305682/clarification-of-a-faster-r-cnn-torchvision-implementation|Clarification of a Faster R-CNN torchvision implementation
65304189|/questions/65304189/gaussianblur-transform-not-found-in-torchvision-transforms|gaussianblur transform not found in torchvision.transforms
65300371|/questions/65300371/runtimeerror-given-groups-1-weight-of-size-64-3-3-3-expected-input4-4|RuntimeError: Given groups=1, weight of size [64, 3, 3, 3], expected input[4, 4, 1024, 2048] to have 3 channels, but got 4 channels instead
65299990|/questions/65299990/pytorch-does-not-pad-the-layers|Pytorch does not pad the layers
65295096|/questions/65295096/how-to-get-the-image-torchvision-utils-save-image-saves-without-reading-it-back|How to get the image torchvision.utils.save_image saves, without reading it back from disk?
65260309|/questions/65260309/still-confused-about-model-train|Still confused about model.train()
65210442|/questions/65210442/skorch-runtimeerror-input-type-torch-cuda-bytetensor-and-weight-type-torch-c|Skorch RuntimeError: Input type (torch.cuda.ByteTensor) and weight type (torch.cuda.FloatTensor) should be the same
65192795|/questions/65192795/file-not-found-archive-constants-pkl-at-python-pytorch|File not found: archive/constants.pkl at Python Pytorch
65181608|/questions/65181608/pytorch-cant-shuffle-the-dataset|pytorch can't shuffle the dataset [closed]
65176803|/questions/65176803/importerror-cannot-import-name-assert-no-grad-from-torch-nn-modules-loss|ImportError: cannot import name '_assert_no_grad' from 'torch.nn.modules.loss'
65121613|/questions/65121613/how-do-i-deal-with-torchvision-datasets|how do i deal with torchvision datasets
64949786|/questions/64949786/python-torch-multilayer-perceptron-api-worse-than-manually-coded|Python - Torch - multilayer perceptron API worse than manually coded?
64915116|/questions/64915116/what-versions-of-fastai-torch-torchvision-are-compatible-for-cuda-10-1-pytho|what versions of Fastai, torch & torchvision are compatible for cuda 10.1, python 3.7?
64903931|/questions/64903931/pytorch-vectorizing-patch-selection-from-a-batch-of-images|PyTorch: Vectorizing patch selection from a batch of images
64871630|/questions/64871630/how-to-convert-pip-install-to-poetry-file|How to convert pip install to Poetry file?
64861685|/questions/64861685/detecting-fixed-size-objects-in-variable-sized-images|Detecting fixed size objects in variable sized images
64705364|/questions/64705364/pytorch-is-tiling-images-when-loaded-with-dataloader|PyTorch is tiling images when loaded with Dataloader
64662102|/questions/64662102/how-to-build-pytorch-from-source-using-numpy|How to build pytorch from source using numpy
64653750|/questions/64653750/pytorch-dll-issues-for-caffe2|PyTorch dll issues for Caffe2
64574142|/questions/64574142/how-to-load-a-dataset-starting-from-list-of-images-pytorch|How to load a dataset starting from list of images Pytorch
64569166|/questions/64569166/what-is-the-best-way-to-represent-spatio-temporal-image-data-in-a-vanilla-lstm|What is the best way to represent spatio-temporal image data in a vanilla LSTM
64515207|/questions/64515207/try-to-run-torch-but-encounter-internal-asset-failed|Try to run torch but encounter INTERNAL ASSET FAILED
64502474|/questions/64502474/how-to-check-which-pytorch-version-fits-torchvision|How to check which pytorch version fits torchvision
64430159|/questions/64430159/torch-cat-along-negative-dimension|torch.cat along negative dimension
64405333|/questions/64405333/torchvision-transforms-normalize-slows-down-learning-when-adding-to-torchvisio|torchvision.transforms.Normalize() slows down learning when adding to torchvision,transforms.Compose()
64348346|/questions/64348346/errorruntimeerror-an-attempt-has-been-made-to-start-a-new-process-before-the-c|Error:RuntimeError: An attempt has been made to start a new process before the current process has finished its bootstrapping phase
64347217|/questions/64347217/error-pickle-picklingerror-cant-pickle-function-lambda-at-0x0000002f2175b|Error :_pickle.PicklingError: Can't pickle <function <lambda> at 0x0000002F2175B048>: attribute lookup <lambda> on __main__ failed
64346112|/questions/64346112/5-51-gib-already-allocated-417-00-mib-free-5-53-gib-reserved-in-total-by-pytor|5.51 GiB already allocated; 417.00 MiB free; 5.53 GiB reserved in total by PyTorch CUDA out of memory
64265194|/questions/64265194/docker-build-error-could-not-find-a-version-that-satisfies-the-requirement-torc|Docker build ERROR: Could not find a version that satisfies the requirement torch==1.5.1
64227234|/questions/64227234/training-loss-when-resuming-from-a-checkpoint-explodes|Training Loss When Resuming From a Checkpoint Explodes
64130178|/questions/64130178/how-to-load-cub-200-2011-dataset-in-pytorch|How to load CUB-200-2011 dataset in pytorch?
64120309|/questions/64120309/pytorch-custom-randomcrop-for-semantic-segmentation|Pytorch custom randomcrop for semantic segmentation
64024508|/questions/64024508/where-are-datasets-downloaded-using-torchvision|Where are datasets downloaded using torchvision?
63978020|/questions/63978020/datasets-imagefolder-doesnot-working-in-python|'datasets.ImageFolder' doesnot working in python
63974588|/questions/63974588/how-to-install-pytorch-with-pipenv-and-save-it-to-pipfile-and-pipfile-lock|How to install PyTorch with pipenv and save it to Pipfile and Pipfile.lock?
63972921|/questions/63972921/error-installing-torchvision-python-3-6|Error installing torchvision (python 3.6)
63921487|/questions/63921487/get-predictions-from-trained-pytorch-model|Get Predictions from Trained Pytorch Model
63913565|/questions/63913565/volatile-was-removed-and-now-has-no-effect-use-with-torch-no-grad-instead|Volatile was removed and now has no effect. Use `with torch.no_grad():` instead
63899917|/questions/63899917/how-can-i-use-the-resnet-architecture-to-classify-a-custom-labeled-set-of-images|How can I use the Resnet architecture to classify a custom labeled set of images?
63781490|/questions/63781490/assertionerror-torch-not-compiled-with-cuda-enabled-problem-in-torch-vision|AssertionError: Torch not compiled with CUDA enabled (problem in torch vision)
63756773|/questions/63756773/how-can-i-apply-a-transformation-to-a-torch-tensor|How can I apply a transformation to a torch tensor
63730320|/questions/63730320/tried-installing-fastai-but-i-got-error-no-matching-distribution-found-for-tor|"Tried installing FastAi but I got ""ERROR: No matching distribution found for torchvision>=0.7"""
63728357|/questions/63728357/how-to-use-one-original-one-augmented-batch-from-torchvision-mnist-dataset-wit|"How to use one original & one augmented batch from torchvision MNIST dataset with shuffeling, ""aligned"" batch samples, but different batch size?"
63660023|/questions/63660023/unable-to-install-pillow-6-2-1-in-conda|Unable to install pillow 6.2.1 in conda
63550778|/questions/63550778/does-low-gpu-utilization-indicate-bad-fit-for-gpu-acceleration|Does low GPU utilization indicate bad fit for GPU acceleration?
63485299|/questions/63485299/when-using-torchvision-ops-roi-align-i-got-the-errorprocess-finished-with-exit|When using torchvision.ops.roi_align, I got the error:Process finished with exit code 139 (interrupted by signal 11: SIGSEGV)
63441299|/questions/63441299/pytorch-cuda-outofmemory-error-while-training|Pytorch CUDA OutOfMemory Error while training
63431889|/questions/63431889/simultaneous-reads-of-the-same-pytorch-torchvision-datasets-object|Simultaneous reads of the same PyTorch torchvision.datasets object
63429260|/questions/63429260/getting-model-class-labels-from-torchvision-pretrained-models|Getting model class labels from torchvision pretrained models
63427771|/questions/63427771/extracting-intermediate-layer-outputs-of-a-cnn-in-pytorch|Extracting Intermediate layer outputs of a CNN in PyTorch
63426905|/questions/63426905/torch-save-gives-runtimeerror-cuda-error-no-cuda-capable-device-is-detecte|torch.save() gives : RuntimeError: CUDA error: no CUDA-capable device is detected
63352551|/questions/63352551/why-is-the-accuracy-difference-so-much-when-i-use-the-image-data-set-and-pytorch|Why is the accuracy difference so much when I use the image data set and pytorch's own data set directly?
63342147|/questions/63342147/how-to-transform-labels-in-pytorch-to-onehot|How to transform labels in pytorch to onehot
63190807|/questions/63190807/opencv-code-keep-crashing-and-didnt-execute-afterward|opencv Code keep crashing and didn't execute afterward
63152023|/questions/63152023/pytorch-1-5-0-cuda-10-2-installation-via-pip-always-installs-cuda-9-2|PyTorch 1.5.0 CUDA 10.2 installation via pip always installs CUDA 9.2
63062741|/questions/63062741/pytorch-and-torchvision-are-compiled-different-cuda-versions|Pytorch and Torchvision are compiled different CUDA versions
63026948|/questions/63026948/pytorch-model-parameters-changes-in-cpu-and-gpu|Pytorch model Parameters changes in CPU and GPU
62998911|/questions/62998911/load-and-freeze-one-model-and-train-others-in-pytorch|load and freeze one model and train others in PyTorch
62974904|/questions/62974904/pytorch-explain-torch-argmax|Pytorch: explain torch.argmax
62952528|/questions/62952528/pytorch-image-transformer-not-converting-to-grayscale|Pytorch: image transformer not converting to grayscale
62931963|/questions/62931963/how-to-add-new-sample-to-cifar10-torchvision|How to add new sample to CIFAR10 torchvision?
62926088|/questions/62926088/runtimeerror-expected-4-dimensional-input-for-4-dimensional-weight-1024-64-3|RuntimeError: Expected 4-dimensional input for 4-dimensional weight [1024, 64, 3, 3], but got input of size [32, 10] instead
62917353|/questions/62917353/how-does-one-use-torch-optim-lr-scheduler-onecyclelr|How does one use torch.optim.lr_scheduler.OneCycleLR()?
62914236|/questions/62914236/for-semantic-segmentation-how-to-perform-data-augmentation-in-pytorch|For semantic segmentation how to perform data augmentation in Pytorch?
62815065|/questions/62815065/how-do-i-use-torchaudio-with-torch-xla-on-google-colab-tpu|How do I use torchaudio with torch_xla on google colab TPU?
62788479|/questions/62788479/how-to-use-pytorch-in-flask-and-run-it-on-wsgi-mod-for-apache2|How to use pytorch in flask and run it on wsgi_mod for apache2
62730486|/questions/62730486/pytorch-albumentations-augmentation-p-value|pytorch albumentations augmentation p value?
62728345|/questions/62728345/flip-with-any-degree-of-angle|flip with any degree of angle?
62670050|/questions/62670050/is-it-possible-to-remove-the-dtype-from-tensor-in-pytorch|is it possible to remove the dtype from tensor in pytorch?
62669720|/questions/62669720/process-got-killed-when-building-docker-image-on-gcp|Process got killed when building docker image on GCP
62669645|/questions/62669645/runtimeerror-expected-object-of-scalar-type-double-but-got-scalar-type-float-fo|RuntimeError: Expected object of scalar type Double but got scalar type Float for argument #2 'other' in call to _th_max
62642393|/questions/62642393/torchvisions-transforms-randomrotation-is-zeroing-out-my-image-tensor|Torchvision's transforms.RandomRotation() is zeroing out my image tensor
62620652|/questions/62620652/cant-load-models-from-torchvision-on-gpu-clusters-in-my-company|Can't load models from torchvision on GPU clusters in my company
62617533|/questions/62617533/trouble-with-pytorchs-topilimage|Trouble with PyTorch's 'ToPILImage'
62542327|/questions/62542327/torchvision-version-issue-when-installing-mmf|torchvision version issue when installing mmf
62513412|/questions/62513412/cannot-install-pip-install-torchvision|cannot install pip install torchvision
62482336|/questions/62482336/classification-with-pretrained-pytorch-vgg16-model-and-its-classes|Classification with pretrained pytorch vgg16 model and its classes
62513412|/questions/62513412/cannot-install-pip-install-torchvision|cannot install pip install torchvision
62482336|/questions/62482336/classification-with-pretrained-pytorch-vgg16-model-and-its-classes|Classification with pretrained pytorch vgg16 model and its classes
62434037|/questions/62434037/python-class-dataset-how-to-concatenate-images-with-their-respective-labels-in|Python, class dataset, how to concatenate images with their respective labels in pytorch
62413906|/questions/62413906/pytorch-4d-numpy-array-applying-transfroms-inside-custom-dataset|pytorch 4d numpy array applying transfroms inside custom dataset
62357045|/questions/62357045/pytorch-totensor-changes-c-x-h-x-w-5-x-600-x-900-to-h-x-c-x-w-900-x-5-x-600|PyTorch ToTensor Changes C x H x W (5 x 600 x 900) to H x C x W (900 x 5 x 600)
62326683|/questions/62326683/prunning-model-doesnt-improve-inference-speed-or-reduce-model-size|Prunning model doesn't improve inference speed or reduce model size
62326497|/questions/62326497/how-did-pytorch-process-images-in-imagenet-when-training-resnet-pretrained-model|How did Pytorch process images in ImageNet when training resnet pretrained models in torchvision.models.resnet34?
62311593|/questions/62311593/bert-resnet-joint-learning-pytorch-model-is-empty-after-instantiation|Bert + Resnet joint learning, pytorch model is empty after instantiation
62285057|/questions/62285057/unable-to-import-torchvision-attributeerror-module-torch-jit-has-no-attribu|Unable to import torchvision --AttributeError: module 'torch.jit' has no attribute 'unused'. Windows10, Python 3.7
62260217|/questions/62260217/how-to-load-dataset-from-pickle-files-into-pytorch|How to load dataset from pickle files into PyTorch?
62248037|/questions/62248037/how-to-get-the-imagenet-dataset-on-which-pytorch-models-are-trained-on|How to get the imagenet dataset on which pytorch models are trained on
62237595|/questions/62237595/how-to-save-logfile-in-torchvision-mask-rcnn-to-plot-in-tensorboard|how to save logfile in torchvision mask rcnn to plot in tensorboard
62232285|/questions/62232285/training-with-pytorch-error-due-to-cuda-memory-issue|Training with Pytorch: error due to CUDA memory issue
62192030|/questions/62192030/how-to-attach-hooks-to-relus-in-inception-v3-from-torchvision|How to attach hooks to ReLUs in Inception V3 from torchvision
62149406|/questions/62149406/how-do-i-predict-using-my-type-torchvision-models-upon-my-set-of-images-pytho|How do I predict using my type <torchvision.models> upon my set of images? Python / Torchvision / PyTorch
62143332|/questions/62143332/how-to-use-pretrained-weights-of-a-model-for-initializing-the-weights-in-next-it|How to use pretrained weights of a model for initializing the weights in next iteration?
62133737|/questions/62133737/how-does-pytorchs-loss-backward-work-when-retain-graph-true-is-specified|"How does PyTorch's loss.backward() work when ""retain_graph=True"" is specified?"
62068434|/questions/62068434/system-shows-all-requested-packages-already-installed-however-i-get-error-messag|system shows All requested packages already installed.however i get error message when i import pytorch
61901144|/questions/61901144/resnet50-torchvision-implementation-gives-low-accuracy-on-cifar-10|ResNet50 torchvision implementation gives low accuracy on CIFAR-10
61877098|/questions/61877098/runtimeerror-expected-4-dimensional-input-for-4-dimensional-weight-64-3-7-7|RuntimeError: Expected 4-dimensional input for 4-dimensional weight [64, 3, 7, 7], but got 3-dimensional input of size [3, 32, 32] instead
61856895|/questions/61856895/nameerror-name-transforms-is-not-defined-while-using-google-colab|NameError: name 'transforms' is not defined, while using google colab
61811946|/questions/61811946/train-valid-test-split-for-custom-dataset-using-pytorch-and-torchvision|Train-Valid-Test split for custom dataset using PyTorch and TorchVision
61726552|/questions/61726552/torchscript-requires-source-access-in-order-to-carry-out-compilation-error-aft|"""TorchScript requires source access in order to carry out compilation"" error after converting script to exe"
61725300|/questions/61725300/torchvision-mnist-remotedisconnected-remote-end-closed-connection-without-respo|torchvision mnist RemoteDisconnected: Remote end closed connection without response
61720638|/questions/61720638/learning-from-images-in-openai-gym-memory-leak-or-offscreen-glfw-issue-with-ren|Learning from Images in openai gym: memory leak or offscreen glfw issue with render function
61709365|/questions/61709365/compiling-pytorch-models-to-coreml-so-they-run-on-the-apple-ane|Compiling Pytorch Models to CoreML so they run on the Apple ANE
61703503|/questions/61703503/importerror-cannot-import-name-optional-from-torch-jit-annotations|ImportError: cannot import name 'Optional' from 'torch.jit.annotations'
61639900|/questions/61639900/error-oserror-winerror-126-le-module-sp%c3%a9cifi%c3%a9-est-introuvable|Error : OSError: [WinError 126] Le module spécifié est introuvable
61577903|/questions/61577903/how-to-split-data-into-train-and-test-sets-from-one-directory-with-pytorch|How to split data into train and test sets from one directory with PyTorch?
61522539|/questions/61522539/i-cant-import-the-ucf-101-dataset-torchvision-list-index-out-of-range-error|I cant import the ucf 101 dataset (torchvision), 'list index out of range' error
61441174|/questions/61441174/get-the-input-channels-for-the-conv2d-from-previous-layer|Get the input channels for the conv2d from previous layer?
61412874|/questions/61412874/unable-to-update-pytorch-1-4-0-to-1-5-0-using-conda|Unable to update PyTorch 1.4.0 to 1.5.0 using Conda
61407421|/questions/61407421/how-to-run-neural-network-model-on-android-taking-advantage-of-gpu|How to run Neural Network model on Android taking advantage of GPU?
61367204|/questions/61367204/sequential-object-has-no-attribute-classifier|'Sequential' object has no attribute 'classifier'
61250268|/questions/61250268/pytorch-typeerror-totensor-takes-no-arguments-using-torchvision-transform|Pytorch - TypeError: ToTensor() takes no arguments using torchvision.transform
61194941|/questions/61194941/how-can-we-provide-the-output-of-a-linear-layer-to-a-conv2d-in-pytorch|How can we provide the output of a Linear layer to a Conv2D in PyTorch?
61092523|/questions/61092523/what-is-running-loss-in-pytorch-and-how-is-it-calculated|What is running loss in PyTorch and how is it calculated
61051335|/questions/61051335/how-to-generate-accurate-masks-for-an-image-from-mask-r-cnn-prediction-in-pytorc|How to generate accurate masks for an image from Mask R-CNN prediction in PyTorch?
61049626|/questions/61049626/how-to-use-input-in-rnn-model|How to use input in RNN model
61046742|/questions/61046742/cannot-import-torchvision-in-python-on-ubuntu|Cannot import torchvision in Python on Ubuntu
61043646|/questions/61043646/attributeerror-rnn-object-has-no-attribute-weight-hh-l|AttributeError: ‘RNN’ object has no attribute ‘weight_hh_l’ [duplicate]
60996756|/questions/60996756/how-do-i-assign-a-numpy-int64-to-a-torch-cuda-floattensor|How do I assign a numpy.int64 to a torch.cuda.FloatTensor?
60958127|/questions/60958127/torchvision-transforms-topilimage-typeerror-function-takes-exactly-1-argument|Torchvision transforms.toPILImage() TypeError: function takes exactly 1 argument (3 given)
60908616|/questions/60908616/pytorch-list-object-has-no-attribute-to|Pytorch List object has no attribute ‘to’
60900406|/questions/60900406/torchvision-transforms-implementation-of-flatten|Torchvision.transforms implementation of Flatten()
60814545|/questions/60814545/pytorch-list-of-supported-gpu-hardware-for-each-release-ubuntu18-04|Pytorch list of supported GPU hardware for each release (Ubuntu18.04)
60781599|/questions/60781599/installing-torchvision-from-source-libavcodec-avcodec-h-not-found|Installing torchvision from source libavcodec/avcodec.h not found
60757610|/questions/60757610/why-torchvision-models-alexnet-not-work-when-i-test-the-input-and-output|why torchvision.models.alexnet() not work when i test the input and output?
