QID|QLink|QHeader
70538711|/questions/70538711/how-to-generate-list-of-sequence-number-in-faster-way-using-python|how to generate list of sequence number in faster way using python
70537225|/questions/70537225/how-to-assign-values-in-a-torch-sparse-coo-tensor|How to assign values in a torch sparse_coo_tensor?
70532485|/questions/70532485/error-when-importing-pytorch-the-filename-or-extension-is-too-long|ERROR WHEN IMPORTING PYTORCH (The filename or extension is too long)
70530937|/questions/70530937/how-to-add-two-torch-tensors-along-given-dimension|How to add two torch tensors along given dimension?
70527591|/questions/70527591/i-am-getting-this-error-while-installing-torch-package|I am getting this error while installing torch package
70526901|/questions/70526901/error-torch-is-not-a-supported-wheel-on-this-platform-linux-non-conda|ERROR: torch is not a supported wheel on this platform (Linux, non-Conda)
70507101|/questions/70507101/transformers-pretraining-with-mlm-problem-sentence-embeddings|Transformers pretraining with MLM problem - sentence embeddings
70503548|/questions/70503548/modulenotfounderror-no-module-named-torch-c-even-from-the-parent-folder|ModuleNotFoundError: No module named 'torch._C' even from the parent folder
70501627|/questions/70501627/why-torch-does-train-using-mini-batches|Why torch does train using mini-batches?
70488489|/questions/70488489/extracting-individual-masks-from-tensor-of-integers|Extracting individual masks from tensor of integers
70483784|/questions/70483784/w-dw-vs-w-w-dw-in-torch|w -= dw vs w = w - dw in torch
70449122|/questions/70449122/change-last-layer-on-pretrained-huggingface-model|Change last layer on pretrained huggingface model
70446215|/questions/70446215/torch-lib-libgomp-d22c30c5-so-1-cannot-allocate-memory-in-static-tls-block|torch/lib/libgomp-d22c30c5.so.1: cannot allocate memory in static TLS block
70438133|/questions/70438133/gradients-of-custom-module-parameter-remains-zero-after-loss-backward|Gradients of custom module parameter remains zero after loss.backward()
70420882|/questions/70420882/concat-two-tensors-with-different-dimensions|Concat two tensors with different dimensions
70392235|/questions/70392235/how-to-install-the-newest-version-of-a-package-with-a-specific-tag|How to install the newest version of a package with a specific tag?
70372116|/questions/70372116/how-to-register-a-forward-hook-for-pytorch-matmul|How to register a forward hook for PyTorch matmul?
70346693|/questions/70346693/how-to-make-a-dynamic-graph-in-torch-geometric-whose-edges-are-changing-with-tim|How to make a dynamic graph in torch_geometric whose edges are changing with time
70320290|/questions/70320290/logsoftmax-with-nll-criterion-stable-made-from-scratch-explodes|LogSoftMax() with NLL Criterion (stable) made from scratch explodes
70276437|/questions/70276437/calculate-kl-divergence-between-the-uniform-distribution-and-the-probability-dis|calculate KL divergence between the uniform distribution and the probability distribution
70275016|/questions/70275016/split-torch-dataset-without-shuffling|Split torch dataset without shuffling
70267810|/questions/70267810/using-nn-cross-entropy-between-outputs-and-target-label|using nn.Cross entropy between outputs and target label
70267566|/questions/70267566/buildozer-android-apk-oserror-debug|Buildozer Android APK OSError debug
70261380|/questions/70261380/remove-torch-tensor-from-a-list-raises-runtimeerror-boolean-value-of-tensor-wit|remove torch tensor from a list raises RuntimeError: Boolean value of Tensor with more than one value is ambiguous
70256003|/questions/70256003/how-can-i-only-train-the-classifier-and-freeze-rest-of-the-parameters-in-pytorch|How can I only train the classifier and freeze rest of the parameters in Pytorch?
70245697|/questions/70245697/where-do-you-get-the-weights-used-for-transfer-learning|Where do you get the weights used for transfer learning?
70244386|/questions/70244386/batching-instead-of-looping-gives-incorrect-result|Batching instead of looping gives incorrect result
70244198|/questions/70244198/can-we-have-nd-node-features-in-pytorch-geometrical-data|Can we have nd node features in pytorch_geometrical.data?
70239838|/questions/70239838/pytorch-model-cuda-and-model-train-give-error-typeerror-children-missing|Pytorch model.cuda() and model.train() give error TypeError: children() missing 1 required positional argument: ‘node’
70238797|/questions/70238797/reshape-tensor-in-an-autoencoder-model-using-fashion-mnist|reshape tensor in an autoencoder model using fashion mnist
70238714|/questions/70238714/attributeerror-module-torchvision-models-detection-has-no-attribute-ssdlite32|Attributeerror module 'torchvision.models.detection' has no attribute 'ssdlite320_mobilenet_v3_large'
70224671|/questions/70224671/vae-mat1-and-mat2-shapes-cannot-be-multiplied-90x12800-and-90x360|VAE: mat1 and mat2 shapes cannot be multiplied (90x12800 and 90x360)
70216222|/questions/70216222/pytorch-is-throwing-an-error-runtimeerror-result-type-float-cant-be-cast-to-th|Pytorch is throwing an error RuntimeError: result type Float can't be cast to the desired output type Long
70205007|/questions/70205007/pytorch-derivative-returns-none-on-grad|pytorch derivative returns none on .grad
70181775|/questions/70181775/detectron2-no-instances-in-prediction|Detectron2: No instances in prediction
70173302|/questions/70173302/how-to-split-into-train-loader-and-test-loader-using-pytorch|How to split into train_loader and test_loader using PyTorch?
70149188|/questions/70149188/why-can-i-not-install-torch-1-4-0|Why can I not install torch == 1.4.0?
70138797|/questions/70138797/calculation-cross-entropy-for-batch-of-two-tensors|Calculation cross entropy for batch of two tensors
70117726|/questions/70117726/how-can-i-get-all-the-user-defined-attributes-of-nn-module|How can I get all the User defined attributes of nn.Module
70116433|/questions/70116433/cuda-not-available-in-pytorch-after-following-all-installation-steps|CUDA not available in PyTorch after following all installation steps
70111562|/questions/70111562/expected-4-dimensional-input-for-4-dimensional-weight-192-768-1-1-but-got|Expected 4-dimensional input for 4-dimensional weight [192, 768, 1, 1], but got 2-dimensional input of size [50, 1000] instead
70108912|/questions/70108912/problem-with-creating-an-exe-out-of-my-python-script-via-pyinstaller|Problem with creating an .exe out of my Python script via Pyinstaller
70069555|/questions/70069555/error-when-installing-torch-through-requirements-txt-for-azure-web-service-deplo|Error when installing torch through requirements.txt for azure web service deployment
70047710|/questions/70047710/runtimeerror-sizes-of-tensors-must-match-except-in-dimension-2-expected-size-3|RuntimeError: Sizes of tensors must match except in dimension 2. Expected size 32 but got size 1 for tensor number 3 in the list
70044442|/questions/70044442/get-warnings-warnuser-provided-device-type-of-cuda-but-cuda-is-not-availa|get warnings.warn('User provided device_type of \'cuda\', but CUDA is not available. Disabling') while train yolov5 model
70043645|/questions/70043645/how-to-convert-from-tensor-to-float|How to convert from tensor to float
70038557|/questions/70038557/python3-torch-waning-removal|python3 torch waning removal
70038369|/questions/70038369/runtimeerror-an-attempt-has-been-made-to-start-a-new-process-before-the-current|RuntimeError: An attempt has been made to start a new process before the current process has finished its bootstrapping phase
70030903|/questions/70030903/error-while-loading-mlflow-model-in-python-3-7|Error while loading MLFlow model in python 3.7
70005814|/questions/70005814/torch-istft-cant-convert-single-bin-back-to-frame|torch.istft can't convert single bin back to frame
69982305|/questions/69982305/how-to-get-triplets-from-an-array|How to get triplets from an array?
69982231|/questions/69982231/how-to-get-opposite-of-cumsum-function|How to get opposite of cumsum function? [duplicate]
69982060|/questions/69982060/how-to-convert-a-b-c-to-abc-bc-c-in-numpy|How to convert [a,b,c] to [a+b+c, b+c, c] in numpy?
69958214|/questions/69958214/cannot-initialize-keras-tensorflow-torch-in-r|cannot initialize keras/tensorflow/torch in R
69922947|/questions/69922947/how-does-kwargs-is-passed-to-a-variable-implicitly|"How does ""kwargs"" is passed to a variable implicitly?"
69914189|/questions/69914189/attributeerror-module-torch-optim-lr-scheduler-has-no-attribute-linearlr|AttributeError: module 'torch.optim.lr_scheduler' has no attribute 'LinearLR'
69897707|/questions/69897707/how-to-solve-my-problem-with-stoke-module-and-cpu-adam|How to solve my problem with stoke module and cpu_adam?
69889395|/questions/69889395/implement-do-sampling-for-custom-gpt-neo-model|implement do_sampling for custom GPT-NEO model
69879166|/questions/69879166/oserror-lib-aarch64-linux-gnu-libgomp-so-1-cannot-allocate-memory-in-static-t|OSError: /lib/aarch64-linux-gnu/libgomp.so.1: cannot allocate memory in static TLS block
69848406|/questions/69848406/libtorchtorch-jit-scriptinput-dynamic-shapeerror-in-loading-pt-file-on|[libtorch][torch.jit.script][input dynamic shape]Error in loading “. pt” file on C + +: index out of range
69786965|/questions/69786965/incorrect-number-of-nodes-for-fully-connected-layer-after-convolutional-layer|Incorrect number of nodes for fully-connected-layer after convolutional layer
69785932|/questions/69785932/rounding-errors-deal-with-operation-on-vectors-with-very-small-components|Rounding errors: deal with operation on vectors with very small components
69752582|/questions/69752582/spyder-complains-torch-module-is-not-found|"Spyder complains ""torch"" module is not found"
69738523|/questions/69738523/how-to-convert-a-tif-pil-image-to-a-torch-tensor|How to convert a .tif PIL image to a torch tensor?
69727976|/questions/69727976/whence-maskrcnns-segm-iou-metrics-0|Whence MaskRCNN's segm IoU metrics = 0?
69722363|/questions/69722363/can-you-use-your-local-cpu-and-google-colabs-gpu-at-the-same-time|Can you use your local CPU and Google Colab's GPU at the same time?
69688593|/questions/69688593/pytorch-dataparallel-with-custom-model|Pytorch DataParallel with custom model
69613265|/questions/69613265/disable-in-place-updates-in-troch-nn|"Disable ""in-place"" updates in troch.nn"
69523980|/questions/69523980/how-to-load-a-torchvision-model-from-disk|How to load a torchvision model from disk?
69508602|/questions/69508602/continue-training-with-torch-save-and-torch-load-key-error-messages|Continue training with torch.save and torch.load - key error messages
69486204|/questions/69486204/error-in-pytorch-libcudart-so-10-2-cannot-open-shared-object-file-no-such-fi|Error in Pytorch : libcudart.so.10.2: cannot open shared object file: No such file or directory
69470989|/questions/69470989/why-does-poetry-install-windows-only-dependency-on-macos-and-linux|Why does poetry install windows only dependency on macOS and linux?
69433280|/questions/69433280/if-we-expand-or-reduce-the-layer-of-the-same-model-can-we-still-be-able-to-trai|If we expand or reduce the layer of the same model, can we still be able to train from pretrained model in Pytorch?
69403235|/questions/69403235/i-cannot-draw-bounding-box-correctly|I cannot draw bounding box correctly
69400007|/questions/69400007/how-do-i-make-exe-file-with-torch-module-by-using-pyinstaller|How do I make exe file with torch module by using pyinstaller?
69348907|/questions/69348907/runtimeerror-the-expanded-size-of-the-tensor-0-must-match-the-existing-size|RuntimeError: The expanded size of the tensor (0) must match the existing size (5) at non-singleton dimension 0
69346001|/questions/69346001/pytorch-nllloss-ignore-index-default-value|pytorch: NLLLoss ignore_index default value
69339628|/questions/69339628/convert-a-torchscript-model-into-core-ml|Convert a torchscript model into Core ML
69286889|/questions/69286889/transformers-and-bert-downloading-to-your-local-machine|transformers and BERT downloading to your local machine
69279485|/questions/69279485/pytorch-building-3d-dense-network-run-into-error-adaptive-avg-pool3d-output-si|Pytorch: Building 3D Dense Network run into error adaptive_avg_pool3d: output_size must be 3
69249740|/questions/69249740/how-to-sample-from-a-distribution-with-constraints-in-pytorch|How to sample from a distribution with constraints in PyTorch?
69239925|/questions/69239925/typeerror-in-torch-argmax-when-want-to-find-the-tokens-with-the-highest-start|TypeError in torch.argmax() when want to find the tokens with the highest `start` score
69217305|/questions/69217305/what-is-the-difference-of-torch-nn-softmax-torch-nn-funtional-softmax-torch-so|what is the difference of torch.nn.Softmax, torch.nn.funtional.softmax, torch.softmax and torch.nn.functional.log_softmax
69206468|/questions/69206468/runtimeerror-cant-call-numpy-on-tensor-that-requires-grad|RuntimeError: Can't call numpy() on Tensor that requires grad
69191821|/questions/69191821/summing-torch-tensor-based-on-another-tensor|Summing Torch tensor based on another tensor
69180832|/questions/69180832/background-removal-with-u2net-is-too-strong|Background removal with U2Net is too strong
69134262|/questions/69134262/error-importing-pytorch-xla-on-google-colab|Error importing PyTorch XLA on Google Colab
69074561|/questions/69074561/android-camera2-flash-mode-torch-not-working-with-control-mode-off-on-some-dev|Android Camera2 - FLASH_MODE_TORCH not working with CONTROL_MODE_OFF on some devices (e.g. Samsung Galaxy S8)
69022879|/questions/69022879/how-to-flush-model-out-of-gpu-in-python-without-restarting-kernel|How to flush model out of GPU in python without restarting kernel
69006922|/questions/69006922/using-rtx3090-with-haystack|Using RTX3090 with Haystack
69004064|/questions/69004064/special-indexing-of-two-1d-numpy-torch-arrays-to-produce-another-array|Special indexing of two 1D numpy / torch arrays to produce another array
68947337|/questions/68947337/tensor-object-has-no-attribute-keras-history|Tensor object has no attribute _keras_history
68942312|/questions/68942312/adaptis-training-gpu-hangs-after-few-iterations|Adaptis Training - GPU hangs after few iterations
68928265|/questions/68928265/problem-with-loading-tiny-imagenet-via-torch-dataloader|Problem with Loading tiny imagenet via torch DataLoader
68903385|/questions/68903385/why-can-i-save-vram-i-just-loaded-the-model-twice|Why can I save VRAM? I just loaded the model twice
68901236|/questions/68901236/urllib-error-httperror-http-error-403-rate-limit-exceeded-when-loading-resnet1|urllib.error.HTTPError: HTTP Error 403: rate limit exceeded when loading resnet18 from pytorch hub
68864035|/questions/68864035/how-to-improve-model-latency-for-deployment|How to improve model latency for deployment
68843547|/questions/68843547/how-to-use-torchtext-to-load-fasttext-pre-trained-word-and-subword-embeddings|How to use TorchText to load FastText pre-trained word and subword embeddings?
68758454|/questions/68758454/how-to-fix-cannot-pickle-thread-lock-object-error-when-using-torch-multipro|"How to fix ""cannot pickle '_thread.lock' object"" error when using torch.multiprocessing.spawn"
68753221|/questions/68753221/typeerror-unsupported-operand-types-for-numpy-ndarray-and-tensor|TypeError: unsupported operand type(s) for @: 'numpy.ndarray' and 'Tensor'
68745819|/questions/68745819/copying-model-output-to-a-torch-tensor-where-requires-grad-is-true|Copying model output to a torch.Tensor where requires_grad is True
68740004|/questions/68740004/calculate-cosine-distance-similarity-between-400k-embeddings|Calculate cosine distance/similarity between 400K embeddings
68736635|/questions/68736635/the-meaning-of-1-x-shape2-where-x-is-a-torch-tensor|the meaning of (-1,)+x.shape[2:] where x is a torch.tensor
68719486|/questions/68719486/checksummismatcherror-conda-detected-a-mismatch-between-the-expected-content-an|ChecksumMismatchError: Conda detected a mismatch between the expected content and downloaded content
68685636|/questions/68685636/einops-rearrange-function-basic-functionallity|Einops rearrange function basic functionallity
68677847|/questions/68677847/torch-tensor-randomly-contains-huge-impossible-values|Torch tensor randomly contains huge, impossible values
68668657|/questions/68668657/receiving-infinity-infinity-in-linestring|Receiving Infinity Infinity in LineString
68625656|/questions/68625656/raspberry-pi-4-8gm-ram-64-bit-os-aarch64-easyocr-torch-opencv-illega|Raspberry PI 4 - 8GM RAM - 64 bit OS aarch64 - easyocr - torch - opencv - illegal instruction
68510107|/questions/68510107/pytorch-reciprocal-of-torch-gather|pytorch - reciprocal of torch.gather
68493579|/questions/68493579/direction-of-rotation-of-torch-rot90|Direction of rotation of torch.rot90
68398231|/questions/68398231/how-can-i-load-torchtext-dataset-for-machine-translation-task-in-pytorch|How can I load torchtext dataset for machine translation task in pytorch?
68391969|/questions/68391969/im-having-issues-uninstalling-pytorch|I'm having issues uninstalling pytorch
68355740|/questions/68355740/problems-installing-torch-for-r-for-mac-arm64|Problems installing Torch for R for Mac arm64
68320515|/questions/68320515/downgrading-from-cuda-11-2-to-11-1-or-10-2-on-google-colab-package-not-found-is|Downgrading from CUDA 11.2 to 11.1 or 10.2 on Google Colab (Package not found issue)
68305315|/questions/68305315/getting-this-while-using-pytorch-transforms-typeerror-integer-argument-expec|Getting this while using pytorch transforms--->TypeError: integer argument expected, got float
68279292|/questions/68279292/is-it-possible-to-expand-nodes-of-a-frozen-neural-network-model-by-width|Is it possible to expand nodes of a frozen neural network model by width?
68268257|/questions/68268257/what-function-is-the-equivalent-of-torch-nn-crossentropyloss-in-tf2-0-for-multic|What function is the equivalent of torch.nn.CrossEntropyLoss in TF2.0 for multiclass logits
68241773|/questions/68241773/pytorch-dataloader-output-is-not-iterable|Pytorch DataLoader output is not iterable
68240674|/questions/68240674/pytorch-unboundlocalerror-local-variable-img-referenced-before-assignment-f|Pytorch - UnboundLocalError: local variable 'img' referenced before assignment for data_loader
68217272|/questions/68217272/torch-is-running-successfully-in-vscode-but-gives-error-in-jupyter-notebook|Torch is running successfully in VSCode but gives error in Jupyter Notebook
68207510|/questions/68207510/how-to-use-torchvision-io-read-image-with-image-as-variable-not-stored-file|How to use torchvision.io.read_image with image as variable, not stored file?
68192626|/questions/68192626/how-to-batch-matrix-vector-multiplication-one-matrix-many-vectors-in-pytorch|How to batch matrix-vector multiplication (one matrix, many vectors) in pytorch without duplicating the matrix in memory
68186036|/questions/68186036/problem-with-installing-pytorch-with-pip3-f-option-requires-1-argument|Problem with installing pytorch with pip3: -f option requires 1 argument
68164163|/questions/68164163/calculate-the-output-of-unlabeled-images-using-a-cnn-algorithm|calculate the output of unlabeled images using a CNN algorithm
68163333|/questions/68163333/ways-to-save-data-frame-of-tensors-into-a-file-for-easy-loading-and-access|Ways to save data frame of tensors into a file for easy loading and access?
68152842|/questions/68152842/index-tensor-must-have-the-same-number-of-dimensions-as-self-tensor|Index tensor must have the same number of dimensions as self tensor
68141216|/questions/68141216/trace-of-a-script-module-in-torchscript|Trace of a script module in TorchScript
68117258|/questions/68117258/can-i-save-multiple-torch-tensors-in-a-list-in-r|Can i save multiple torch tensors in a list in R?
68107103|/questions/68107103/how-to-convert-audio-byte-stream-to-torch-tensor|How to convert audio byte stream to torch tensor?
68102018|/questions/68102018/pytorch-column-wise-reduction-using-multiplication|PyTorch Column-wise reduction using multiplication
68099818|/questions/68099818/how-to-extract-values-of-tensor-type-from-multiple-dictionnary-in-a-pandasseries|how to extract values of tensor type from multiple dictionnary in a pandasseries?
68097523|/questions/68097523/how-do-i-understand-the-gradient-for-complex-functions-that-do-not-satisfy-the-c|How do I understand the gradient for complex functions that do not satisfy the Cauchy Reimann Equation
68091548|/questions/68091548/modulenotfounderror-no-module-named-torch-when-installing-trt-pose|ModuleNotFoundError: No module named 'torch' when installing TRT_pose
68090115|/questions/68090115/torch-neural-network-converges-very-slowly|Torch neural network converges very slowly
68068422|/questions/68068422/converting-a-scripted-scriptmodule-to-a-trace-one|Converting a scripted ScriptModule to a Trace one
68045496|/questions/68045496/runtimeerror-during-one-hot-encoding|RunTimeError during one hot encoding
67934978|/questions/67934978/python-drop-index-from-tensor|Python: drop index from tensor
67934643|/questions/67934643/pytorch-inferencing-form-the-model-is-giving-me-different-results-every-time|Pytorch Inferencing form the model is giving me different results every time
67929085|/questions/67929085/expected-index-while-trying-to-use-label-propagation|Expected index while trying to use Label propagation
67912012|/questions/67912012/indexerror-the-shape-of-the-mask-at-index-0-does-not-match-the-shape-of-t|IndexError: The shape of the mask [...] at index 0 does not match the shape of the indexed tensor [...] at index 0
67904276|/questions/67904276/pytorch-mixed-precision-learning-torch-cuda-amp-running-slower-than-normal|Pytorch mixed precision learning, torch.cuda.amp running slower than normal
67857884|/questions/67857884/import-torch-not-defined-on-gcp|import torch not defined on gcp
67782927|/questions/67782927/after-applying-torchvision-transforms-on-mnsit-dataset-how-to-view-it-using-cv2|After applying torchvision.transforms on mnsit dataset, how to view it using cv2_imshow?
67759230|/questions/67759230/how-to-load-a-saved-model-defined-in-a-function-in-pytorch-in-colab|How to load a saved model defined in a function in PyTorch in Colab?
67751088|/questions/67751088/is-reshape-same-as-contiguous-view|Is reshape() same as contiguous().view()?
67738319|/questions/67738319/joint-training-of-two-embedding-models-kge-glove|Joint training of two embedding models (KGE + GloVe)
67738117|/questions/67738117/runtime-error-found-no-nvidia-driver-on-your-system|Runtime Error: Found no NVIDIA driver on your system
67706477|/questions/67706477/load-pytorch-model-from-s3-bucket|Load pytorch model from S3 bucket
67695716|/questions/67695716/failed-to-build-cutorch-when-install-cutorch-in-luarocks|"Failed to build ""cutorch"" when install cutorch in luarocks"
67689432|/questions/67689432/make-a-nn-module-faster|Make a nn.Module faster
67686991|/questions/67686991/vectorize-code-and-remove-nested-loops-from-pytorch-code|Vectorize code and remove nested loops from pytorch code
67686701|/questions/67686701/how-to-convert-torch-norm-to-cosine-distance|How to convert torch.norm to cosine distance
67677223|/questions/67677223/does-torch-save-overwrite-the-previous-saved-model-which-was-saved-in-the-same|Does torch.save() overwrite the previous saved model which was saved in the same path?
67672528|/questions/67672528/shuffling-along-a-given-axis-in-pytorch|Shuffling along a given axis in PyTorch
67665639|/questions/67665639/pytorch-runtimeerror-caught-runtimeerror-in-replica-0-on-device-0|Pytorch: RuntimeError: Caught RuntimeError in replica 0 on device 0
67598712|/questions/67598712/installing-detectron2-in-heroku|Installing detectron2 in Heroku
67582406|/questions/67582406/how-to-update-tensors-matching-dimensionwise-vectors|How to update tensors matching dimensionwise vectors
67554041|/questions/67554041/how-to-use-torch-custom-dataset-with-fastai-data-loaders|How to use torch custom dataset with fastai data loaders
67539912|/questions/67539912/reverse-operation-of-torch-cat|Reverse operation of torch.cat
67527145|/questions/67527145/model-totorch-devicecuda-error-torch-not-compiled-with-cuda-enabled|"model.to(torch.device(""cuda"")) Error - Torch not compiled with CUDA enabled"
67507142|/questions/67507142/torch-hub-loadpyannote-pyannote-audio-dia-doesnt-work-in-local|torch.hub.load('pyannote/pyannote-audio', 'dia') doesn't work in local
67496315|/questions/67496315/how-to-efficiently-multiply-by-torch-tensor-with-repeated-rows-without-storing-a|How to efficiently multiply by torch tensor with repeated rows without storing all the rows in memory or iterating?
67445508|/questions/67445508/is-it-advisable-to-use-the-same-torch-dataset-class-for-training-and-predicting|Is it advisable to use the same torch Dataset class for training and predicting?
67436336|/questions/67436336/find-pid-number-from-torch-tensorflow-device|Find PID number from Torch/ Tensorflow DEvice
67421904|/questions/67421904/use-pytorch-to-speed-up-linear-least-squares-optimization-with-bounds|Use PyTorch to speed up linear least squares optimization with bounds?
67418709|/questions/67418709/why-doesnt-torch-see-%d1%81uda|Why doesn't torch see сuda?
67393293|/questions/67393293/issue-with-calculating-accuracy|issue with calculating accuracy
67389071|/questions/67389071/attention-weighted-aggregation|Attention weighted aggregation
67387383|/questions/67387383/numpy-equivalent-code-of-unsqueeze-and-expand-from-torch-tensor-method|numpy equivalent code of unsqueeze and expand from torch tensor method
67386709|/questions/67386709/pytorch-custom-cuda-extension-build-fails-for-torch-1-6-0-or-higher|Pytorch custom CUDA extension build fails for torch 1.6.0 or higher
67365218|/questions/67365218/cuda-version-of-package-not-importing|CUDA version of package not importing?
