QID|QLink|QHeader
71269516|/questions/71269516/dataloaders-wrapping-an-iterable-over-the-dataset-means|DataLoaders - wrapping an iterable over the Dataset means?
71267824|/questions/71267824/getting-image-path-through-a-torchvision-dataloader-using-local-images|Getting image path through a torchvision dataloader using local images
71260127|/questions/71260127/attributeerror-list-object-has-no-attribute-view-while-training-network|AttributeError: 'list' object has no attribute 'view' while training network
71259578|/questions/71259578/valueerror-not-enough-values-to-unpack-expected-2-got-1-when-training-model|ValueError: not enough values to unpack (expected 2, got 1) when training model
71258858|/questions/71258858/writing-a-custom-dataset-to-pytorch|writing a custom dataset to pytorch
71233673|/questions/71233673/preparing-csv-file-for-neural-network-machine-learning-python|Preparing CSV file for neural network machine learning Python
71160604|/questions/71160604/converting-pytorch-map-style-dataset-to-iterable-dataset-with-multi-process-data|Converting pytorch map style dataset to iterable dataset with multi process data loading
71147870|/questions/71147870/why-does-the-support-value-in-classification-report-change-when-i-change-the-dat|Why does the Support value in classification_report change when I change the DataLoader batch size?
71111982|/questions/71111982/how-to-do-prediction-in-batches-using-data-loaders-for-hugging-face-models|How to do prediction in batches using data loaders for hugging face models
71098331|/questions/71098331/pytorch-dataloader-prints-the-same-features|Pytorch DataLoader prints the same features
71080043|/questions/71080043/is-there-a-good-way-to-access-batch-id-in-pytorch-datasets-using-dataloaders|Is there a good way to access batch id in pytorch datasets using dataloaders?
71070249|/questions/71070249/is-it-possible-to-get-dataset-file-infromation-at-the-time-of-test-a-model|Is it possible to get dataset file infromation at the time of test a model?
71040931|/questions/71040931/pytorch-cnn-script-training-but-not-getting-results|Pytorch CNN script training, but not getting results
71013697|/questions/71013697/how-do-i-address-root-in-pytorches-imagefolder|How do I address root in pytorches' ImageFolder
70921841|/questions/70921841/mnist-data-processing-pytorch|MNIST data processing - PyTorch
70892017|/questions/70892017/normalize-mnist-in-pytorch|Normalize MNIST in PyTorch
70831281|/questions/70831281/when-data-loader-fetchs-next-batch-loader-wouldnt-run-my-function-in-getitem|when data loader fetchs next batch, loader wouldn`t run my function in _getitem_
70823746|/questions/70823746/setting-num-workers-0-makes-my-script-skip-the-trainloader-and-start-from-lin|Setting num_workers >= 0 makes my script skip the trainloader and start from line 0. My model will not train and just finish the script
70813287|/questions/70813287/alternate-training-between-two-datasets|Alternate training between two datasets
70757195|/questions/70757195/pytorch-forecasting-dataloader-timeseriesdataset-with-two-differently-scaled-dat|PyTorch Forecasting Dataloader/TimeSeriesDataSet with two differently scaled DataFrames (by unix) as Input/Output
70734095|/questions/70734095/two-pytorch-distributedsampler-same-seeds-different-shuffling-multiple-gpu-s|two pytorch DistributedSampler same seeds different shuffling multiple GPU-s
70703655|/questions/70703655/unable-to-create-a-custom-torchtext-bucketiterator|Unable to create a custom torchtext BucketIterator
70698487|/questions/70698487/how-to-get-a-pytorch-data-loader-per-class|How to get a Pytorch data loader per class?
70654233|/questions/70654233/loading-splitting-same-training-data-but-getting-different-results|Loading & splitting same training data but getting different results
70631432|/questions/70631432/pytorch-model-loss-and-accuracy-remain-constant|Pytorch model loss and accuracy remain constant
70557151|/questions/70557151/how-to-make-current-data-loader-more-efficient-in-pytorch|How to make current data loader more efficient in Pytorch?
70523304|/questions/70523304/how-to-flow-pytorch-tensor-data-from-a-folder|how to flow pytorch tensor data from a folder?
70490038|/questions/70490038/how-can-i-map-classes-labels-to-integers-and-convert-them-to-tensors|How can I map classes/labels to integers and convert them to tensors
70487852|/questions/70487852/pytorch-notimplementederror-when-trying-to-iterate-a-dataloader|pytorch: NotImplementedError when trying to iterate a dataloader
70487501|/questions/70487501/dataloaders-targets-object-has-no-attribute-type-in-pytorch|Dataloader's 'targets' object has no attribute 'type' in pytorch
70483124|/questions/70483124/torch-nn-crossentropyloss-over-multiple-batches|torch.nn.CrossEntropyLoss over Multiple Batches
70471684|/questions/70471684/having-pytorch-dataloader-object-group-batches-on-a-single-attribute|Having Pytorch Dataloader object group batches on a single attribute
70465323|/questions/70465323/how-can-i-speed-up-using-pytorch-dataloader|How can I speed up using Pytorch DataLoader?
70442784|/questions/70442784/pytorch-serialize-data-from-an-imagefolder-dataset-into-a-file|pytorch serialize data from an ImageFolder dataset into a file
70442533|/questions/70442533/pytorch-dataloader-doesnt-return-batched-data|Pytorch DataLoader doesn't return batched data
70433612|/questions/70433612/when-downloading-mnist-i-cant-get-the-processed-folder|"When downloading MNIST, I can't get the ""processed"" folder"
70405450|/questions/70405450/invalid-datatype-for-loaders-pytorch-lightning-datamodule|Invalid Datatype for loaders - Pytorch Lightning DataModule
70394523|/questions/70394523/batch-size-for-custom-collate-function-with-variable-input-sizes|Batch size for custom Collate Function with variable input sizes
70386249|/questions/70386249/modify-python-class-to-filter-files|Modify Python Class to filter files
70371053|/questions/70371053/using-pytorch-dataloader-with-probability-distribution|Using Pytorch Dataloader with Probability Distribution
70369070|/questions/70369070/can-a-pytorch-dataloader-start-with-an-empty-dataset|Can a PyTorch DataLoader start with an empty dataset?
70351242|/questions/70351242/shallow-and-deep-copies-in-pytorch-dataloader-and-or-getitem-function|shallow and deep copies in pytorch dataloader and/or __getitem__ function
70312281|/questions/70312281/looping-through-torch-geometric-loader-dataloader-object|Looping through torch_geometric.loader.DataLoader Object
70305833|/questions/70305833/runtimeerror-shape-128-1-is-invalid-for-input-of-size-378-pytorch|RuntimeError: shape '[128, -1]' is invalid for input of size 378 pytorch
70275016|/questions/70275016/split-torch-dataset-without-shuffling|Split torch dataset without shuffling
70272764|/questions/70272764/how-is-the-maximum-number-of-workers-in-pytorch-dataloader-decided-if-there-are|How is the maximum number of workers in PyTorch DataLoader decided if there are 2 CPUs in a node?
70218051|/questions/70218051/oserror-errno-22-invalid-argument-pickle-unpicklingerror-pickle-data-was|"OSError: [Errno 22] Invalid argument | _pickle.UnpicklingError: pickle data was truncated"
70173302|/questions/70173302/how-to-split-into-train-loader-and-test-loader-using-pytorch|How to split into train_loader and test_loader using PyTorch?
70114187|/questions/70114187/reduce-2d-pytorch-tensor-to-1d-tensor-model-not-training-cause-of-error-in-for|Reduce 2d pytorch tensor to 1d tensor & Model not training cause of error in for loop
70096029|/questions/70096029/pytorch-custom-dataloader-failed-to-load-imagenet30-runtimeerror-errno-2-no|Pytorch custom dataloader failed to load ImageNet30 - RuntimeError: [Errno 2] No such file or directory
70089964|/questions/70089964/i-o-issues-in-loading-several-large-h5py-files-pytorch|I/O Issues in Loading Several Large H5PY Files (Pytorch)
70033258|/questions/70033258/runtime-error-with-pytorch-and-num-workers|Runtime error with Pytorch and num_workers
69998900|/questions/69998900/how-to-iterate-the-tokenized-pytorch-multi30k-dataset-in-bucketiterator|How to Iterate the tokenized pytorch Multi30k dataset in BucketIterator?
69964502|/questions/69964502/i-can-predict-one-image-but-not-a-set-of-images-with-a-pytorch-resnet18-model-h|I can predict one image but not a set of images with a pytorch resnet18 model, how can i predict a set of images in a list using pytorch models?
69908760|/questions/69908760/multiprocessing-in-iterabledataset-for-videoloading|Multiprocessing in IterableDataset for VideoLoading
69860541|/questions/69860541/pytorch-tensor-mnist-image-ploting|Pytorch Tensor MNIST Image Ploting
69832280|/questions/69832280/convert-a-adjacency-matrix-into-the-torch-geometric-data-data-format-using-pytho|convert a adjacency matrix into the torch_geometric.data.Data format using python or R
69820318|/questions/69820318/predicting-sentiment-of-raw-text-using-trained-bert-model-hugging-face|Predicting Sentiment of Raw Text using Trained BERT Model, Hugging Face
69788455|/questions/69788455/understanding-and-applying-pytorch-datasets|understanding and applying pytorch datasets
69771247|/questions/69771247/efficient-way-of-using-numpy-memmap-when-training-neural-network-with-pytorch|Efficient way of using numpy memmap when training neural network with pytorch
69712077|/questions/69712077/understanding-the-timeseriesdataset-in-pytorch-forecasting|Understanding the TimeSeriesDataSet in pytorch forecasting
69684438|/questions/69684438/get-only-evenodd-digits-as-output-of-a-dataloader|Get only even(+odd) digits as output of a dataloader
69683898|/questions/69683898/pytorch-checking-model-accuracy-results-in-typeerror-bool-object-is-not-ite|"PyTorch: Checking Model Accuracy Results in ""TypeError: 'bool' object is not iterable."""
69648607|/questions/69648607/remove-validation-data-from-train-dataset|Remove validation data from train dataset
69585470|/questions/69585470/how-to-push-nlp-model-trained-with-pytorch-in-hugging-face|How to push NLP model trained with pytorch in hugging face?
69559664|/questions/69559664/when-i-add-workers-to-neutral-network-i-get-an-error-pytorch|When I add workers to neutral network I get an error, pytorch
69545355|/questions/69545355/when-to-put-pytorch-tensor-on-gpu|When to put pytorch tensor on GPU?
69532024|/questions/69532024/how-can-i-download-to-my-pc-an-image-dataset-after-loading-it-into-a-dataloader|How can I download to my pc an image dataset after loading it into a dataloader in pytorch?
69518768|/questions/69518768/pytorch-load-and-save-error-in-loading-state-dict-when-trying-to-continue-trai|pytorch.load and save - error in loading state_dict when trying to continue training
69510702|/questions/69510702/pytorch-sequential-data-loader|Pytorch sequential data loader
69503156|/questions/69503156/pytorch-batch-masked-select-implementation|PyTorch Batch masked select implementation
69460106|/questions/69460106/how-to-fetch-a-list-type-from-pytorch-dataloader|How to fetch a List-type from Pytorch DataLoader?
69395367|/questions/69395367/dataloader-throwing-error-typeerror-new-data-must-be-a-sequence-got-map|Dataloader throwing error TypeError: new(): data must be a sequence (got map)
69378276|/questions/69378276/how-to-save-images-generated-by-pytorch-dataloader|How to save images generated by PyTorch DataLoader?
69250127|/questions/69250127/when-i-use-dataset-in-pytorch-i-encountered-an-error-typeerror-cannot-pickle|When I use dataset in pytorch, I encountered an error TypeError: cannot pickle '_thread.lock' object, here is my error code
69227925|/questions/69227925/got-wrong-size-of-dimensions-after-using-dataloader|"Got wrong size of dimensions after using ""dataloader"""
69187967|/questions/69187967/reduce-inference-time-for-bert|Reduce inference time for BERT
69159160|/questions/69159160/runtimeerror-found-no-nvidia-driver-on-your-system-please-check-that-you-have|RuntimeError: Found no NVIDIA driver on your system. Please check that you have an NVIDIA GPU and installed a driver from http://www.nvidia.com/
69111862|/questions/69111862/torch-utils-data-dataloader-why-it-adds-a-dimension|torch.utils.data.DataLoader - why it adds a dimension
69018998|/questions/69018998/file-mtrand-pyx-line-905-in-numpy-random-mtrand-randomstate-choice-typeerror|"File ""mtrand.pyx"", line 905, in numpy.random.mtrand.RandomState.choice TypeError: 'dict_keys' object cannot be interpreted as an integer"
69006831|/questions/69006831/something-wrong-when-i-use-the-dataloader|Something wrong when I use the Dataloader
68931909|/questions/68931909/dataloader-worker-exited-unexpectedly-pids-48817-48818|DataLoader worker exited unexpectedly (pid(s) 48817, 48818)
68893942|/questions/68893942/importing-transparent-images-gives-runtimeerror-the-size-of-tensor-a-4-must-m|Importing Transparent images gives RuntimeError: The size of tensor a (4) must match the size of tensor b (3) at non-singleton dimension 0
68888375|/questions/68888375/import-transparent-images-to-gan|Import transparent images to GAN
68881602|/questions/68881602/pytorch-custom-dataloader-working-with-multiple-csvs|PyTorch custom DataLoader working with multiple CSVs
68866101|/questions/68866101/how-can-i-fix-this-notimplementederror-in-python-class-module-while-working-in-p|How can I fix this NotImplementedError in python class module while working in pytorch framework?
68858397|/questions/68858397/custom-images-with-gan|Custom Images with GAN
68849171|/questions/68849171/what-are-the-benefits-of-using-class-when-defining-a-dataloader-in-pytorch|What are the benefits of using class when defining a dataloader in Pytorch?
68807958|/questions/68807958/pytorch-nn-crossentropyloss-indexerror-target-2-is-out-of-bounds|PyTorch nn.CrossEntropyLoss IndexError: Target 2 is out of bounds
68782144|/questions/68782144/pytorch-can-i-group-batches-by-length|PyTorch: Can I group batches by length?
68779859|/questions/68779859/keyerrornone-i-dont-understand-this-problem|Keyerror:None ,I don't understand this problem
68767275|/questions/68767275/difference-in-classification-model-output-after-input-image-preprocessing-with-t|Difference in Classification Model output after input image preprocessing with torch.transforms and OpenCV
68756034|/questions/68756034/pytorch-problem-my-jupyter-stuck-when-num-workers-0|Pytorch Problem: My jupyter stuck when num_workers > 0
68692578|/questions/68692578/can-i-use-pytorch-data-loader-to-load-raw-data-images-which-are-saved-in-csv-fil|can i use PyTorch Data Loader to load raw data images which are saved in CSV files?
68664217|/questions/68664217/pytroch-data-loader-runtimeerror-stack-expects-each-tensor-to-be-equal-size-bu|pytroch data loader RuntimeError: stack expects each tensor to be equal size, but got [224, 224] at entry 0 and [224, 224, 3] at entry 1 [duplicate]
68563474|/questions/68563474/pytorch-iter-runs-endlessly-or-throws-recursionerror|Pytorch iter() runs endlessly or throws RecursionError
68536085|/questions/68536085/pytorch-random-split-is-returning-wrong-sized-loader|PyTorch random_split() is returning wrong sized loader
68429241|/questions/68429241/best-way-to-handle-batch-during-training-and-inference-in-pytorch-with-gpu|Best way to handle batch during training and inference in Pytorch with GPU
68402165|/questions/68402165/how-to-create-a-custom-pytorch-dataset-with-multiple-labels-and-masks|How to Create a Custom Pytorch Dataset with Multiple Labels and Masks?
68395293|/questions/68395293/how-do-i-solve-the-multi-processing-problem-with-pytorch-in-windows-10|How do I solve the multi-processing problem with pytorch in windows 10
68356565|/questions/68356565/how-to-iterate-through-composed-dataset-in-pytorch-with-no-overlapped-batches|How to iterate through composed dataset in pytorch with no overlapped batches?
68308541|/questions/68308541/weird-train-test-accuracy-in-graph-neural-network-model-and-runtimeerror-pytorc|Weird Train/Test accuracy in graph neural network model and Runtimeerror: pytorch
68240674|/questions/68240674/pytorch-unboundlocalerror-local-variable-img-referenced-before-assignment-f|Pytorch - UnboundLocalError: local variable 'img' referenced before assignment for data_loader
68229246|/questions/68229246/pytorch-torchvision-datasets-imagefolder-filenotfounderror-found-no-valid-file|pytorch torchvision.datasets.ImageFolder FileNotFoundError: Found no valid file for the classes .ipynb_checkpoints
68181227|/questions/68181227/pytorch-dataset-for-video|Pytorch Dataset for video
68056004|/questions/68056004/how-to-write-collate-fn-correctly-in-my-case|How to write collate_fn correctly in my case?
68054775|/questions/68054775/problem-with-pytorch-dataset-imagefolder-with-custom-dataset-in-google-colab|Problem with pytorch dataset.imageFolder with custom dataset in Google Colab
68020017|/questions/68020017/inputs-and-outputs-to-pytorch-layers|Inputs and Outputs to PyTorch layers
67941749|/questions/67941749/what-is-the-fastest-way-to-load-data-from-multiple-csv-files|What is the fastest way to load data from multiple csv files
67887705|/questions/67887705/pytorch-load-data-in-mini-batches|Pytorch load data in mini batches
67799246|/questions/67799246/weighted-random-sampler-oversample-or-undersample|Weighted random sampler - oversample or undersample?
67792384|/questions/67792384/how-to-convert-the-polygon-json-into-an-image-mask-for-image-segmentation|How to convert the polygon json into an image mask for image segmentation?
67619611|/questions/67619611/how-to-train-pytorch-model-using-batches-with-partial-information|How to train pytorch model using batches with partial information
67591570|/questions/67591570/pytorch-file-specific-action-for-each-image-in-the-batch|Pytorch: File-specific action for each image in the batch
67584404|/questions/67584404/valueerrorneed-at-least-one-array-to-stack|ValueError('need at least one array to stack')
67578328|/questions/67578328/datacollatorformultiplechoice-gives-keyerror-labels-in-trainer-train|DataCollatorForMultipleChoice gives KeyError: 'labels' in trainer.train
67530442|/questions/67530442/how-to-use-collate-fn-properly-in-the-code-below|how to use collate_fn properly in the code below?
67508634|/questions/67508634/speechbrain-dataio-prepare-function-with-csv|SpeechBrain: dataio_prepare function with csv
67447071|/questions/67447071/custom-dataset-not-accepting-argument-in-pytorch|Custom Dataset not accepting argument in PyTorch
67445508|/questions/67445508/is-it-advisable-to-use-the-same-torch-dataset-class-for-training-and-predicting|Is it advisable to use the same torch Dataset class for training and predicting?
67441163|/questions/67441163/how-to-get-dataset-from-prepare-data-to-setup-in-pytorch-lightning|How to get dataset from prepare_data() to setup() in PyTorch Lightning
67406731|/questions/67406731/pytorch-import-dataset-with-images-as-labels|PyTorch - Import dataset with images as labels
67398465|/questions/67398465/what-i-missing-here-using-imagefolder-to-get-the-full-folder-name-as-labels-for|What I missing here, using ImageFolder to get the full folder name as labels for MNIST-double dataset images?
67209968|/questions/67209968/pytorch-dataloader-if-input-data-returns-multiple-training-instances|pytorch Dataloader - if input data returns multiple training instances
67120788|/questions/67120788/typeerror-conv2d-argument-input-position-1-must-be-tensor-not-str|TypeError: conv2d(): argument 'input' (position 1) must be Tensor, not str
67109376|/questions/67109376/how-to-create-a-data-preprocessing-pipeline-in-pytorch-outside-the-dataloader-cl|How to create a data preprocessing pipeline in pytorch outside the Dataloader class?
67098245|/questions/67098245/sampler-argument-in-dataloader-of-pytorch|sampler argument in DataLoader of Pytorch
66995380|/questions/66995380/target-size-and-input-size-not-matching-despite-minibatches-tells-otherwise|"Target size and input size not matching despite ""minibatches"" tells otherwise"
66964723|/questions/66964723/get-the-length-of-every-sentence-before-padding-in-torchtext-bucketiterator|Get the length of every sentence before padding in torchtext bucketiterator
66934996|/questions/66934996/how-to-combine-two-image-features-in-a-custom-pytorch-dataset|How to combine two image features in a custom pytorch dataset?
66817773|/questions/66817773/displaying-images-loaded-with-pytorch-dataloader|Displaying images loaded with pytorch dataloader
66718763|/questions/66718763/spliting-the-dataset-using-subsetrandomsampler-not-working|Spliting the dataset using SubsetRandomSampler not working
66695251|/questions/66695251/define-manually-sorted-mnist-dataset-with-batch-size-1-in-pytorch|Define manually sorted MNIST dataset with batch size = 1 in PyTorch
66642338|/questions/66642338/strange-cuda-out-of-memory-behavior-in-pytorch|Strange Cuda out of Memory behavior in Pytorch
66534126|/questions/66534126/how-to-build-a-data-loader-from-list-in-pytorch|How to build a data loader from list in pytorch
66451860|/questions/66451860/how-to-train-a-masked-language-model-with-a-big-text-corpus200gb-using-pytorch|How to train a Masked Language Model with a big text corpus(200GB) using PyTorch？
66446881|/questions/66446881/how-to-use-a-pytorch-dataloader-for-a-dataset-with-multiple-labels|How to use a Pytorch DataLoader for a dataset with multiple labels
66401369|/questions/66401369/how-to-gather-prediction-result-on-tpu-pytorch|How to gather prediction result on TPU (Pytorch)?
66370787|/questions/66370787/pytorch-dataloading-freezes-when-running-several-jobs-on-a-gcp-instance|PyTorch dataloading “freezes” when running several jobs on a GCP instance
66370250|/questions/66370250/how-does-pytorch-dataloader-interact-with-a-pytorch-dataset-to-transform-batches|How does PyTorch DataLoader interact with a PyTorch dataset to transform batches?
66356029|/questions/66356029/create-a-pytorch-testing-dataset-without-labels|Create a pyTorch testing Dataset (without labels)
66349285|/questions/66349285/concatenate-along-z-axis-pytorch-dataloader|Concatenate along z axis PyTorch Dataloader
66348912|/questions/66348912/am-getting-error-trying-to-predict-on-a-single-image-cnn-pytorch|Am getting error trying to predict on a single image CNN pytorch
66236251|/questions/66236251/train-simple-rnn-from-a-map-of-t-f-values-and-bitstring-keys-in-pytorch|Train simple RNN from a map of T/F values and bitstring keys in pytorch
66228697|/questions/66228697/pytorch-select-batches-according-to-label-in-data-column|PyTorch, select batches according to label in data column
66065272|/questions/66065272/customizing-the-batch-with-specific-elements|Customizing the batch with specific elements
66038612|/questions/66038612/how-can-i-use-torch-dataloader-to-get-picture-having-same-class|How can I use torch Dataloader to get Picture having same class?
66028727|/questions/66028727/nameerror-name-utils-is-not-defined-in-pytorch|NameError: name 'utils' is not defined in Pytorch
65979207|/questions/65979207/applying-a-simple-transformation-to-get-a-binary-image-using-pytorch|Applying a simple transformation to get a binary image using pytorch
65960597|/questions/65960597/runtimeerror-multi-target-not-supported-at-pytorch-aten-src-thcunn-generic-cla|RuntimeError: multi-target not supported at /pytorch/aten/src/THCUNN/generic/ClassNLLCriterion.cu:15____
65932328|/questions/65932328/pytorch-while-loading-batched-data-using-dataloader-how-to-transfer-the-data-t|PyTorch: while loading batched data using Dataloader, how to transfer the data to GPU automatically
65761728|/questions/65761728/learning-rate-finder-for-cnnlstm-model|Learning rate finder for CNNLstm model
65757115|/questions/65757115/pytorch-out-of-gpu-memory-in-test-loop|PyTorch out of GPU memory in test loop
65704680|/questions/65704680/pytorch-dataloader-using-mongo-db|PyTorch DataLoader using Mongo DB
65668608|/questions/65668608/getting-an-error-while-training-resnet50-on-imagenet-at-14th-epoch|Getting an error while training Resnet50 on Imagenet at 14th Epoch
65554711|/questions/65554711/how-to-shuffle-the-batches-themselves-in-pytorch|How to shuffle the batches themselves in pytorch?
65528954|/questions/65528954/display-number-of-images-per-class-using-pytorch|Display number of images per class using Pytorch
65528568|/questions/65528568/how-do-i-load-the-celeba-dataset-on-google-colab-using-torch-vision-without-ru|How do I load the CelebA dataset on Google Colab, using torch vision, without running out of memory?
65409025|/questions/65409025/jit-the-collate-function-in-pytorch|JIT the collate function in Pytorch
65277135|/questions/65277135/how-to-get-text-from-torchtext-data-dataset-dataset|How to get text from torchtext.data.dataset.Dataset
65091965|/questions/65091965/what-is-mean-by-attributeerror-nonetype-object-has-no-attribute-array-int|What is mean by (AttributeError: 'NoneType' object has no attribute '__array_interface__') error?
65057895|/questions/65057895/optimize-pytorch-data-loader-for-reading-small-patches-in-full-hd-images|Optimize pytorch data loader for reading small patches in full HD images
64855924|/questions/64855924/datalouder-in-pytorch-spyketorch-problem-of-transformed-data-extraction|DataLouder in PyTorch / SpykeTorch: problem of transformed data extraction
64796931|/questions/64796931/pytorch-node2vec-typeerror-tuple-indices-must-be-integers-or-slices-not-tupl|Pytorch: Node2Vec: TypeError: tuple indices must be integers or slices, not tuple
63884278|/questions/63884278/importing-an-externally-defined-function-to-pytorch-dataset|Importing an externally defined function to pytorch Dataset
62461602|/questions/62461602/pytorch-dataset-dataloader-batching|PyTorch Dataset / Dataloader batching
74231905|/questions/74231905/how-to-convert-eigen-martix-to-torch-tensor|How to convert Eigen Martix to Torch Tensor?
74216327|/questions/74216327/functions-unavailable-in-diffsharp|Functions unavailable in DiffSharp
